06_vazov_017|зафанат от дълго, прекъсван, оставян
06_vazov_018|и пред кандилото сред нощ пак залавян?
06_vazov_019|Поличби ли божи записваше там?
06_vazov_020|Слова ли духовни измисляше сам за във чест на някой славен чудотворец, египтянин, елин или светогорец?
06_vazov_021|Що се той мореше с тоя дълъг труд?
06_vazov_022|Ил бе философ?
06_vazov_023|Или беше луд?
06_vazov_024|Или туй канон бе тежък и безумен, наложен на него от строгий игумен?
06_vazov_025|Най-после отдъхна и рече: „Конец!
06_vazov_026|На житие ново аз турих венец.“
06_vazov_027|И той фърли поглед любовен, приветен към тоз труд довършен, подвиг многолетен,
06_vazov_028|на волята рожба, на бденьето плод,
06_vazov_029|погълнал безшумно полвина живот —
06_vazov_030|житие велико!
06_vazov_031|Заради което той забрави всичко, дори и небето!
06_vazov_032|Нивга майка нежна първенеца свой тъй не е гледала, ни младий герой първите си лаври, ни поетът мрачен своят идеал нов,
06_vazov_033|чуден светлозрачен! и кат някой древен библейски пророк
06_vazov_034|ил на Патмос дивний пестинника строг,
06_vazov_035|кога разкривал е въз гладката кожа тайните на мрака и волята божа,
06_vazov_036|той фърли очи си разтреперан, бляд
06_vazov_037|към хаоса тъмний, към звездния свят,
06_vazov_038|към Бялото море, заспало дълбоко,
06_vazov_039|и вдигна тез листи, и викна високо:
06_vazov_040|„От днеска нататък българският род
06_vazov_041|история има и става народ!
06_vazov_042|Нека той познае от мойто писанье, че голям е той бил и пак ще да стане,
06_vazov_043|че от славний Будин до светий Атон
06_vazov_044|бил е припознаван нашият закон.
06_vazov_045|Нека всякой брат наш да чете, да помни,
06_vazov_046|че гърците са люде хитри, вероломни,
06_vazov_047|че сме ги блъскали, и не един път —
06_vazov_048|и затуй не можат нази търпят —
06_vazov_049|и че сме имали царства и столици,
06_vazov_050|и от нашта рода светци и патрици;
06_vazov_051|че и ний сме дали нещо на светът
06_vazov_052|и на вси Словене книга да четът;
06_vazov_053|и кога му викат:
06_vazov_054|„Българину!“ бесно,
06_vazov_055|той да се гордее с това име честно.
06_vazov_056|Нека наш брат знае, че бог е велик
06_vazov_057|и че той разбира българский язик,
06_vazov_058|че е срам за всякой, който се отрича от своя си рода и при гърци тича
06_vazov_059|и своето име и божия дар
06_vazov_060|зафърля безумно като един твар.
06_vazov_061|Горко вам, безумни, овци заблудени,
06_vazov_062|със гръцка отрова, що сте напоени,
06_vazov_063|дето се срамите от вашия брат и търсите пища в гръцкия разврат,
06_vazov_064|и ругайте грешно бакини си кости,
06_vazov_065|и нашите нрави, че те били прости!
06_vazov_066|Та не вашто племе срам нанася вам, о, безумни люде, а вий сте му срам!
06_vazov_067|Четете да знайте, що в стари години по тез земи славни вършили деди ни,
06_vazov_068|как със много кралства имали са бран и от царе силни вземали са дан, и била велика българската държава;
06_vazov_069|как свети Борис се покръстил в Преслава,
06_vazov_070|как е цар Асен тук храмове градил
06_vazov_071|и дарове пращал; кой бе Самуил, дето си изгуби душата във ада,
06_vazov_072|покори Дурацо и влезе в Елада;
06_vazov_073|четете и знайте кой бе цар Шишман
06_vazov_074|и как нашто царство сториха го плян;
06_vazov_075|кой би Иван Рилски, чийто свети мощи чудеса се славят до тоя ден йоще;
06_vazov_076|как се Крум преславний с Никифора би
06_vazov_077|и из черепа му руйно вино пи
06_vazov_078|и как Симеон цар угрите прогони
06_vazov_079|и от Византия приема поклони.
06_vazov_080|А тоя беше учен, философ велик
06_vazov_081|и не се срамеше от своя език
06_vazov_082|и кога нямаше кого да надвива, той пишеше книги, за да си почива.
06_vazov_083|Четете и знайте, що съм аз писал, от много сказанья и книги събрал,
06_vazov_084|четете, о, братя, да ви се не смеят и вам чужденците да не се гордеят…
06_vazov_085|На ви мойта книга, тя е вам завет,
06_vazov_086|нека де преписва и множи безчет
06_vazov_087|и пръска по всички поля и долини,
06_vazov_088|де българин страда, въздиша и гине.
06_vazov_089|Тя е откровенье, божа благодат —
06_vazov_090|младий прави мъдър, а стария — млад,
06_vazov_091|който я прочита няма да се кае,
06_vazov_092|който знае нея, много ще да знае.“
06_vazov_093|Тъй мълвеше тоз мъж, в килията скрит,
06_vazov_094|със поглед умислен, в бъдещето впит,
06_vazov_095|който много бденья, утринни пропусна,
06_vazov_096|но пачето перо нивга не изпусна
06_vazov_097|и против канонът и черковний звън —
06_vazov_098|работи без отдих, почивка и сън.
06_vazov_099|Тъй мълвеше преди сто и двайсет годин тоз див Светогорец — за рая негоден,
06_vazov_100|и фърляше тайно през мрака тогаз най-първата искра в народната свяст.
06_vazov_101|Край на одата „Паисий“.
08_vazov_000|Одата „Раковски“ от цикъла „Епопея на забравените“ на Иван Вазов.
08_vazov_001|Този запис е за LibriVox и е обществено достояние.
08_vazov_002|Раковски
08_vazov_003|Мечтател безумен, образ невъзможен, на тъмна епоха син бодър, тревожен,
08_vazov_004|Раковски, ти дремеш под бурена гъст,
08_vazov_005|из който поглежда полусчупен кръст.
08_vazov_006|Син, дреми, почивай, ти, който не спеше,
08_vazov_007|ти, кой беше вихър,
08_vazov_008|котел, що кипеше над някакъв злобен, стихиен огън.
08_vazov_009|Спи!
08_vazov_010|Кой ще разбужда вечния ти сън?
08_vazov_011|Природата веща беше се сбъркала:
08_vazov_012|тя от теб да стори гений бе искала,
08_vazov_013|затова в глава ти като в една пещ
08_vazov_014|фърли толкоз пламък и възторг горещ,
08_vazov_015|но друг таен демон се намеси тамо: ти стана създанье от крайности само,
08_vazov_016|елемент от страсти, от злъчка и мощ,
08_vazov_017|душа пълна с буря, с блясък и със нощ.
08_vazov_018|Твойта вражда беше вражда сатанинска,
08_vazov_019|твойта любов беше любов исполинска,
08_vazov_020|любов без съмненье, без свяст, без предел,
08_vazov_021|що кат кръст огромен ти беше понел.
08_vazov_022|Твоят символ беше: смърт или свобода,
08_vazov_023|сънят ти — Балкана, кумирът — народа,
08_vazov_024|народа с безчестье и с кърви облян.
08_vazov_025|Твоят живот целий беше един блян!
08_vazov_026|Ти гледаше бледен в бъдещето скрито.
08_vazov_027|Ти се вреше дръзко в миналото срито
08_vazov_028|и оттам влечеше кат победен знак векове от слава, затулени в мрак,
08_vazov_029|за царе, юнаци вълшебни преданья,
08_vazov_030|обраснали с плесен старинни сказанья;
08_vazov_031|твоят орлов поглед виждаше навред от българска слава останки безчет
08_vazov_032|и в тъмна ни древност, бездънна провала, ти вкарваше смело вселената цяла.
08_vazov_033|Нищо невъзможно за теб не оста.
08_vazov_034|ти даваше образ на всяка мечта.
08_vazov_035|На неми загадки, сфинкси безответни предлагаше твойте въпроси заветни;
08_vazov_036|исторйята, мракът,
08_vazov_037|времето, редът
08_vazov_038|не значеха много в големий ти път;
08_vazov_039|ти иска да бутнеш, о, дух безпокоен, нещастен мечтател, апостол и воин,
08_vazov_040|в един час делото на пет векове.
08_vazov_041|Чухме ний твойте горди викове,
08_vazov_042|когато при Сава и при Дъмбовица викна пръв „Свобода! Сяйна е зорница!“
08_vazov_043|И ту с перо остро, ту с гореща реч надеждите сейше наблиз и далеч.
08_vazov_044|Един само буден сред толкова спящи,
08_vazov_045|ти един за всички като демон бдящи работи, бори се, стреска, вълнува,
08_vazov_046|тук мъдрец замислен, там луда глава,
08_vazov_047|мрачен узник в Стамбул, генерал в Балкана,
08_vazov_048|поет и разбойник под съща премяна,
08_vazov_049|мисъл и желязо, лира и тръба:
08_vazov_050|всичко ти бе вкупом за една борба.
08_vazov_051|Исторйята има да се позамисли във кой лик безсмъртен тебе да причисли.
08_vazov_052|Ти умря.
08_vazov_053|И пътят към гроба ти ням обрасъл е вече със бурен голям,
08_vazov_054|и прахът ти гние без сълзи набожни…
08_vazov_055|Не зарасна само, герою тревожни,
08_vazov_056|проломът широкий, който ти тогаз
08_vazov_057|в бъдещето тъмно отвори за нас!
08_vazov_058|1882
08_vazov_059|Пловдив
08_vazov_060|Край на одата „Раковски“.
11_vazov_000|Одата „Волов“ от цикъла „Епопея на забравените“ на Иван Вазов.
11_vazov_001|Този запис е за LibriVox и е обществено достояние.
11_vazov_002|Волов
11_vazov_003|Те бягаха бледни пред дивата сган.
11_vazov_004|И Волов, юнакът, цял в кърви облян, извика:
11_vazov_005|„О, боже! О, адска измама!
11_vazov_006|подвигът пропадна и надежда няма!
11_vazov_007|къде да се скрием от безславната смрът?“
11_vazov_008|Балканът
11_vazov_009|Аз нямам за вази ни завет, ни път.
11_vazov_010|Градът
11_vazov_011|Аз имам бесила.
11_vazov_012|Хижата
11_vazov_013|Аз имам проклятья.
11_vazov_014|Янтра
11_vazov_015|Елате, нещастни, във мойте обятия!
11_vazov_016|Пловдив, ноември 1883.
11_vazov_017|Край на одата „Волов“.
003_vazov_000|Баланиади от Христо Смирненски. Прочетено на български език за LibriVox.org от Георги Стойчев.
003_vazov_001|Гърбосложен на кревата, аз жадувам твоя стан
003_vazov_002|и в унесница благата от мечти съм пак пиян.
003_vazov_003|Себеспомням скъпи срещи на Борисов дървосад,
003_vazov_004|ръкостисници горещи, отлетели безвъзврат.
003_vazov_005|Пеперудени одежди себеспомням си с тъга;
003_vazov_006|ластовичокрилни вежди пак тревожат ме сега.
003_vazov_007|Себеспомням лунни нощи, себеспомням всеки ден.
003_vazov_008|Устодопреници още нощем мир не дават мен.
003_vazov_009|Сърцесладките минути кат зърна на нижел скъп,
003_vazov_010|сетне ядовете люти, сетне душетровна скръб…
003_vazov_011|Гърбосложен на кревата, аз жадувам твоя стан
003_vazov_012|и в унесница благата стих въртя à la Balan.
003_vazov_013|Крайна стихотворението.
003_vazov_014|Този запис е обществено достояние.