03_vazov_043|като пред десница, що принася мщенье.
03_vazov_044|Битката утихна…Разредя димът,
03_vazov_045|и някой глас чу се, че ехти в шумът:
03_vazov_046|— Ний се бихме, братя, с башибозуци,
03_vazov_047|защото са мръсни, диви и хайдуци…
03_vazov_048|Ето, царска сила, да се предадем!
03_vazov_049|— Не щем! — Не! — Не бива! По-добре да мрем!
03_vazov_050|— Пушките си дайте!
03_vazov_051|— Не! Не! — Що да сторим?
03_vazov_052|— Да се покорим ли? — Мълчи! Да се борим!
03_vazov_053|— Предателят кой е?!
03_vazov_054|— Долу! — викат с бяс. —
03_vazov_055|Спогодба не става между тях и нас!
03_vazov_056|Една жена викна: „Чуйте! Срам)!“
03_vazov_057|и пушна към войската царска и падна бездушна,
03_vazov_058|и гърмът разклати смаяний народ!
03_vazov_059|Трепна всяко сърце и всякой живот,
03_vazov_060|огънят обхвана тия души горди.
03_vazov_061|— Да се не вдадеме на турските орди!
03_vazov_062|И гърмежът почна, и боят със гнев
03_vazov_063|подзе своя страшен и грабен напев,
03_vazov_064|но йоще по-страшно и йоще по-гробно.
03_vazov_065|и смъртта из храма фучеше злокобно.
03_vazov_066|Отчаянье мрачно ицата вапца,
03_vazov_067|майки не познаха своите деца, отвън срешу храма зяпнали пушкала
03_vazov_068|забълваха пламък и бомби, и хала!
03_vazov_069|и стените стари разлюляха с звук
03_vazov_070|кат внезапний вятър планинския бук
03_vazov_071|като тръс подземен многажди повторен.
03_vazov_072|изведнъж видяха там зидът съборен!
03_vazov_073|Перущице бедна, тнездо на гепои,
03_vazov_074|слава! Вечна слава на чедата твои,
03_vazov_075|на твоята пепел и на твоя гроб,
03_vazov_076|дето храбро падна въстаналий роб!
03_vazov_077|Слава теб, че ти се одържа до крайност
03_vazov_078|и бори се в пушек, и падна със сяйност.
03_vazov_079|Ти в борбата черна и пред турский гнев
03_vazov_080|издигна високо твоя свилен лев,
03_vazov_081|и глава не клюмна, и меча ни даде,
03_vazov_082|и твойта светиня срамно не предаде,
03_vazov_083|и нашта свобода ти я освети.
03_vazov_084|и за толкоз жъртви гордо отмъсти.
03_vazov_085|Поклон на теб, граде, пепелище прашно,
03_vazov_086|на борба юнашка свидетелство страшно!
03_vazov_087|Твойте чеда бяха силни в трудний час,
03_vazov_088|твойта гибел беше тържество за нас,
03_vazov_089|защото ти падна със падане ново
03_vazov_090|и в нашта исторйя тури светло слово.
03_vazov_091|Защото ти блесна в синия простор
03_vazov_092|след многото подлост, сред общий позо!
03_vazov_093|Защото пропадна и в гроб се халоса славно както Прага, както Сарагоса,
03_vazov_094|обвита във пущек, окъпана в кръв;
03_vazov_095|защото ти — сетня — пример даде пръв
03_vazov_096|как мре народа и не моли бога,
03_vazov_097|и не рече: Милост!
03_vazov_098|— в общата тревога;
03_vazov_099|и — нищожна, тъмна, без крепост, без мощ
03_vazov_100|и със голи ръце,
03_vazov_101|и без никой вожд,
03_vazov_102|без минало славно, без примери славни, що малките правят с великите равни,
03_vazov_103|ти с твойта смърт страшна и храбри моми
03_vazov_104|Картаген надмина, Спарта засрами.
03_vazov_105|Но войската скоро храмът окръжава,
03_vazov_106|отвсякъде ужас и смърт приближава.
03_vazov_107|и сганта, упита от лакома стръв,
03_vazov_108|и гладна за блудство,
03_vazov_109|за месо и кръв
03_vazov_110|изскърца със зъби.
03_vazov_111|Бомбите трещяха и момите красни с децата пишяха.
03_vazov_112|Слисаните майки с поглед страховит
03_vazov_113|блъскаха глави си о голия зид
03_vazov_114|и падаха,
03_vazov_115|други — с настръхнали власи във свойте колене душаха деца си.
03_vazov_116|Във тоя миг Кочо — простият чизмар,
03_vazov_117|наранен отслабнал и бунтовник стар,
03_vazov_118|повика жена си — млада хубавица, на гърди с детенце със златна косица
03_vazov_119|и рече:
03_vazov_120|„Невасто Виж, настая сеч
03_vazov_121|и по-лошо нещо…
03_vazov_122|Ти разбираш веч…
03_vazov_123|Искаш ли да умреш?“
03_vazov_124|— И клетата майка бледна, луда, няма и без да завайка,
03_vazov_125|сложи се детето с трептящи ръце
03_vazov_126|и кат го цалуна в бялото чебце,
03_vazov_127|задтана и рече:
03_vazov_128|„То да е отзади!
03_vazov_129|Удряй!“…
03_vazov_130|И Кочо ножът си извади кървав из гърди й;
03_vazov_131|и чучур червен бликна и затече,
03_vazov_132|и Кочо втрещен погледна детето.
03_vazov_133|То плачеше, клето!
03_vazov_134|„Майка ти не ще и сама на небето!“
03_vazov_135|Рече и замахна като в някой сън
03_vazov_136|и възви глава си, пламнала в огън.
03_vazov_137|Главицата падна, трупът се затресе
03_vazov_138|и кръвта детинска с майчинта се смеси.
03_vazov_139|И Кочо пак рече:
03_vazov_140|„Не остана мощ, но за един удар имам сила йощ!“
03_vazov_141|И ножът димещи опря с две ръце
03_vazov_142|право дето тупа негово сърце.
03_vazov_143|И падна обагрен, грозен, страховит
03_vazov_144|с отворени очи и със нож забит.
03_vazov_145|И храмът ехтеше от моми, невести,
03_vazov_146|кат падаха в кръвье или в безчестье!
03_vazov_147|И господ от свода, през гъстия дим,
03_vazov_148|гледаше на всичко
03_vazov_149|тих, невъзмутим!…
03_vazov_150|Край на одата „Кочо“.
04_vazov_000|Одата „Братя Жекови“ от цикъла „Епопея на забравените“ на Иван Вазов.
04_vazov_001|Този запис е за LibriVox и е обществено достояние.
04_vazov_002|Братя Жекови
04_vazov_003|В една ниска плевня, под тъмната стряха
04_vazov_004|двамината братя укрилии се бяха.
04_vazov_005|Четата отмина. По-старият брат от треската хваната, разтреперан, бляд,
04_vazov_006|лежеше на голо в ръка с револвера
04_vazov_007|и той рече слабо:
04_vazov_008|„Защо тъй трепера!
04_vazov_009|Животът отива, във огън горя
04_vazov_010|Под таз плевня тясна страх ме е да мра…
04_vazov_011|Ще ми се на воля, в боя, на полето поне да издъхна и куршум в сърцето.“
04_vazov_012|Внезапно на двора се чу шум голям и глас викна гърлест: „Излезте оттам!“
04_vazov_013|Стопанинът уплашен гости си обади!
04_vazov_014|Вчера ги прие той, днеска ги предаде.
04_vazov_015|Защото страхът е бездушен и длеп,
04_vazov_016|на малките души — съветник свиреп.
04_vazov_017|Той е дух, що лази. В тъмното ме царство подлостта братува с тъпото коварство.
04_vazov_018|И чавек от него е жълт като смин.
04_vazov_019|И бащата сочи скрития си син,
04_vazov_020|и майката пуща детето на друма кат бяга и тихо: „Олекна ми!“ — дума,
04_vazov_021|и не сеща трепет, ни любов, ни жал, защото душа и страх е завладял.
04_vazov_022|Но Михаил Жеков, бръз като вихрушка, става болен, бледен, грабва свойта пушка
04_vazov_023|и гръмва към двора и вика: „Назад!“
04_vazov_024|И косата щръкна на по-малкия брат.
04_vazov_025|И турската паплач изрева: „Удрете!“
04_vazov_026|И битка се почна между враговете.
04_vazov_027|Дворът веч трепери в гърмежът, в димът.
04_vazov_028|И двамата братя до входа стоят
04_vazov_029|с револвери черни и с мъжко решенье да умрат.
04_vazov_030|Очи им със кръв са налени.
04_vazov_031|Сърцата им чукат, ръце им треперят
04_vazov_032|и пращат във купа и ужас, и смърт.
04_vazov_033|Плявата е мека, на пропуск не дава.
04_vazov_034|Куршумите удрят кат о скала здрава.
04_vazov_035|Боят е неравен: двама срещу сто.
04_vazov_036|Кат рой ястреби над птиче гнездо, убийците тичат, реват обикалят плевнята и пушкат,
04_vazov_037|и в прах се повялат
04_vazov_038|кат кокошки много, що ги лази мор,
04_vazov_039|и кръвта се лее по шумния двор.
04_vazov_040|— Огън дайте скоро! — викна Мустафата
04_vazov_041|и падна:
04_vazov_042|куршумът пръсна му главата.
04_vazov_043|— Да запалим! — вика смаяната сган.
04_vazov_044|И в плевнята скоро проникна думан.
04_vazov_045|Михаил остана корав като камък,
04_vazov_046|но брат му отслабна пред близкия пламък.
04_vazov_047|— Да се вдадем, рече,
04_vazov_048|тук ще изгорим!
04_vazov_049|Страшно ме отравя горещият дим!
04_vazov_050|Михаил бе страшен. Злобно затрепера:
04_vazov_051|— Ти не си ми брат бил!
04_vazov_052|— Вдигна револвера и гръмна в тила му.
04_vazov_053|Братът се простря.
04_vazov_054|Михаил погледна и рече:
04_vazov_055|— Умря!
04_vazov_056|И всред гъстий пушек пак рече:
04_vazov_057|— Ще сваря!
04_vazov_058|Гръмна се в челото и падна в пожара.
04_vazov_059|И две души бели в грозния плам
04_vazov_060|фръкнаха към бога свободни, без срам.
04_vazov_061|Край на одата „Братя Жекови“.
05_vazov_000|Одата „Каблешков“ от цикъла „Епопея на забравените“ на Иван Вазов.
05_vazov_001|Този запис е направен с LibriVox.
05_vazov_002|Всички записи за LibriVox са обществено достояние.
05_vazov_003|За повече информация или за участие като доброволец, моля посетете LibriVox.org
05_vazov_004|Каблешков
05_vazov_005|Няколко месеца как е ралото паднало от ръцете им.
05_vazov_006|Предаността към огнището, връзките на челядта,
05_vazov_007|прелестите на тихия селски живот,
05_vazov_008|сладките думи на любовниците:
05_vazov_009|любовта към отечеството замести всичко.
05_vazov_010|Те живеят само за него.
05_vazov_011|Българио, хвърли своето презрение на хулителите, които разгласяват, че ти можеш да отхранваш само роби.
05_vazov_012|Сърцето на тия роби бие с със силата на петвековните ти теглила!…
05_vazov_013|„Отечество“ — Константин Величко
05_vazov_014|О, Каблешков бедни!
05_vazov_015|Тоз народ поробен да мисли за слава не беше способен;
05_vazov_016|игото тежеше на неговий врат, без да предизвика гордия му яд.
05_vazov_017|Той беше спокоен. С позор на челото безропотно, хладно живейше в теглото.
05_vazov_018|Яремът му беше и родствен, и мил,
05_vazov_019|понеже се беше със него родил;
05_vazov_020|от люлката с него в живота бе тръгнал и на труда беше като вол обръгнал.
05_vazov_021|Народът бе мирен и почти засмян,
05_vazov_022|сред робството тежко ходеше пиян,
05_vazov_023|защото теглото — и то е пиянство
05_vazov_024|и прави по-мило злото окаянство,
05_vazov_025|и разумът мъти на простий народ,
05_vazov_026|и държи го в дрямка, и прави го скот.
05_vazov_027|Той ядеше, пийше, жнеше по Петровден,
05_vazov_028|срещаше Великден, чакаше Гергьовден,
05_vazov_029|по Коледа весел колеше прасето…
05_vazov_030|А мъките бяха страшни под небето!
05_vazov_031|Тираните бесни върлуваха веч.
05_vazov_032|Полята пищяха от техния меч,
05_vazov_033|всеки ден от кърви невинни залети, всеки ден злодейства — хабери проклети:
05_vazov_034|тук обран търговец, друг — ранили зле,
05_vazov_035|там орача кървав в нивата нашле —
05_vazov_036|някой баща беден на седем дечица — днес пламнала плевня, утре воденица!
05_vazov_037|Обири и дъждья, грабеж, произвол!
05_vazov_038|Сюрмахът без стряха,
05_vazov_039|орачът без вол остаяха.
05_vazov_040|Турчин беснееше, гладен,
05_vazov_041|властта беше глуха и съдът продаден.
05_vazov_042|И нищо по-друго.
05_vazov_043|Робът беше як, игото влачил е, ще го влачи пак.
05_vazov_044|И никоя съвест не трепваше гнявно против туй живене и мране безславно.
05_vazov_045|И слово свободно и надеждна реч до никой слух робски не стигаше веч.
05_vazov_046|Левски бе угаснал преди три години.
05_vazov_047|И народът спеше.
05_vazov_048|Небесата сини блещяха със трепет над робския край и питаха бога:
05_vazov_049|„Докога ще трай таз земя в теглото и рабските звънци позорно ще дрънкат и нашето слънце да свети над нея, а да гледа мрак?
05_vazov_050|Докога ще дремят, о, господи благ?“
05_vazov_051|Така те мълвяха в пространството чудно.
05_vazov_052|А народът спеше, спеше непробудно.
05_vazov_053|Каблешков избухна една вечер тук
05_vazov_054|и разклати всичко като тръбен звук.
05_vazov_055|Делото се почна и думата падна на земя из тайно за свобода гладна.
05_vazov_056|Дух един потаен навред профърча и всякоя възраст, пол, класа, душа,
05_vazov_057|размърда, разбуди като гора спяща,
05_vazov_058|що тихият вятър внезапно разклаща.
05_vazov_059|Някой твар незнаен смъкна се тогаз,
05_vazov_060|сърцата стеснени сетиха завчас, че стават големи и тупат по-силно от някакво чувство велико, умилно;
05_vazov_061|и рабското иго стана изведнъж несносно и страшно. — Всякой стана мъж!
05_vazov_062|Идеята бърже поникна, порасна
05_vazov_063|и като от изток зората прекрасна облада душите с новия си жар…
05_vazov_064|Всякой беше бодър: як, слаб, млад и стар,
05_vazov_065|богатий и бедний под покрива сламен —
05_vazov_066|всичките горяха от същия пламен
05_vazov_067|и бързаха нещо да направят там.
05_vazov_068|От толкоз търпенье усетиха срам.
05_vazov_069|Всичко кипеше. Великото слово на сърцата даде биене по-ново,
05_vazov_070|прежната апатйя и хладност, и сън сега бяха треска, живот и огън.
05_vazov_071|Усилия, мисли, желания скрити,
05_vazov_072|към една се точка упътиха всите,
05_vazov_073|и преображенье внезапно стана,
05_vazov_074|и бащата смаен сина не узна.
05_vazov_075|Младежът забрави шума, веселбите
05_vazov_076|и фана да дири места по-закрити за срещи потайни…
05_vazov_077|И простий чизмар въз стола четеше вестника със жар,
05_vazov_078|със глава подпряна, с изпуснато шило,
05_vazov_079|и друг път сърце му не бе така било.
05_vazov_080|И скромний учител във своя урок
05_vazov_081|фана да загатва за „тиранин жесток“.
05_vazov_082|и речта „свобода“ да повтаря често.
05_vazov_083|И всяко сърце и време, и место духът на борбата изпълваше веч.
05_vazov_084|За друго тогава не ставаше реч.
05_vazov_085|Враждите престанаха и любов безкрайна свърза в едно всички кат велика тайна;
05_vazov_086|всякой бе приятел, всякой беше брат.
05_vazov_087|Забравиха всичко, щото бе отзад:
05_vazov_088|зависти, раздори и минало мрачно;
05_vazov_089|като чрез слияне свещено и брачно, всички се сдушиха и със веселба решиха се вече за смърт, за борба.
05_vazov_090|Едно дело общо, едничка цел свята вдъхваше душите, сгряваше сърцата.
05_vazov_091|Въодушевленье нечуто завчас смая всеки разум, упи всяка свяст!
05_vazov_092|Народът живейше със чувство само.
05_vazov_093|Свободата беше пленила ума му.
05_vazov_094|Той се бе усетил изведнъж голям и готов за бунта, и храбър, и сам;
05_vazov_095|и колосът турски с грамадна си сила бе за него нищо — империя гнила —
05_vazov_096|способна да рухне при първия крак…
05_vazov_097|И тъмна надежда, и сладостен мрак затуляха всичко
05_vazov_098|— бъдещето бурно се криеше още в небе лазурно,
05_vazov_099|явен беше само един идеал
05_vazov_100|от мечти и светлост образуван цял.
05_vazov_101|И всичко се друго губеше в мъглата…
05_vazov_102|Лудостта владейше, умът и главата
05_vazov_103|от другаде потик приимаха веч.
05_vazov_104|Борбата бе близко, близкото далеч…
05_vazov_105|Очите с очите се срещаха скришно и да се разбират словото бе лишно.
05_vazov_106|Тайната бе обща, мракът и нощта свидетели бяха на много неща;
05_vazov_107|и кат някой демон подземен и мощен чукът на ковача не спираше нощем: желязото меко из светлия жар излизаше утром на лъскав ханджар;
05_vazov_108|младите крояха опинци хайдушки, продаваха всичко, купуваха пушки,
05_vazov_109|търговците бледи в застоя голям оловото само продаваха там!
05_vazov_110|И в избите скришом със шъпот и с глуми
05_vazov_111|младите хлапаци леяха куршуми.
05_vazov_112|Булките печаха пексемед тогаз.
05_vazov_113|Селяните хитри стягаха без глас черешовий дънер с обръчи железни
05_vazov_114|и гледаха важно, мислейки се трезни…
05_vazov_115|И върху гергьофа балканският лев излазяше златен и зенал за рев.
05_vazov_116|И с тез сили малки, и с тез средства смешни,
05_vazov_117|и с тез глави руси, и с тез пръсти нежни,
05_vazov_118|и с тоз възторг луди, и с тоз дребен стан
05_vazov_119|искаха да бутнат страшний великан!
05_vazov_120|И в няколко дена тайно и полека
05_vazov_121|народът порасте на няколко века!
05_vazov_122|Край на одата „Каблешков“.
06_vazov_000|Одата „Паисий“ от цикъла „Епопея на забравените“ на Иван Вазов.
06_vazov_001|Този запис е за LibriVox и е обществено достояние.
06_vazov_002|Паисий
06_vazov_003|О, неразумни юроде!
06_vazov_004|Поради что се срамиш да се наречиш Болгарин?…
06_vazov_005|Или не са имали Болгаре царство и господарство?
06_vazov_006|Ти, Болгарино, не прелщайся,
06_vazov_007|знай свой род и язик…
06_vazov_008|Паисий 1762
06_vazov_009|Сто и двайсет годин… Тъмнини дълбоки!
06_vazov_010|Тамо вдън горите атонски високи, убежища скрити от лъжовний мир,
06_vazov_011|место за молитва, за отдих и мир,
06_vazov_012|де се чува само ревът беломорски или вечний шепот на шумите горски,
06_vazov_013|ил на звона тежкий набожнийят звън,
06_vazov_014|във скромна килийка, потънала в сън, един монах тъмен, непознат и бледен пред лампа жумеща пишеше наведен.
06_vazov_015|Що драскаше той там умислен, един?
06_vazov_016|Житие ли ново, нов ли дамаскин,
