staroplaninskilegendi_01_yovkov_0000|Старопланински легенди от Юрдан Йовков
staroplaninskilegendi_01_yovkov_0001|Записано за LibriVox. Всички записи на LibriVox са обществено достояние. За повече информация посетете LibriVox.org
staroplaninskilegendi_01_yovkov_0002|Шибил.
staroplaninskilegendi_01_yovkov_0003|Радка на порти стоеше, отдолу иде Мустафа.
staroplaninskilegendi_01_yovkov_0004|Народно песен.
staroplaninskilegendi_01_yovkov_0005|Шибил, страшният хайдутин, когато заптията и кърсердари търсиха под дърво и камък, слизаше от планината и отиваше да се предаде. Утре тая вест щеше да се разчуе навсякъде, кой щеше да я повярва. Шибил малко се грижеше за това. Той бързаше и мислеше за друго.
staroplaninskilegendi_01_yovkov_0006|Мислеше си как преди месец-два, от високите върхове на сините камъни, където между гнездата на орлите беше и неговото хайдошко гнездо, той видя, че долу по пътя идат жени.
staroplaninskilegendi_01_yovkov_0007|Не беше в хайдушките правила да се задяват жени, нито имаше място за жени в сърцето на хайдутина. Но Шибил беше погазил много закони и не знаеше вече, нито искаше да знае кое е грях и кое не.
staroplaninskilegendi_01_yovkov_0008|Жени тук сред джендемите, помисли се той. И това е добра плячка.
staroplaninskilegendi_01_yovkov_0009|и той стана незагрежен ни наймалка на къде го влече любопитството му.
staroplaninskilegendi_01_yovkov_0010|Хайдутите тръгнаха след него, засмяха се и зъбите им лъснаха като нагладни вълци.
staroplaninskilegendi_01_yovkov_0011|Слязоха долу, минаха през гората, която още не беше се развила и излязоха на пътя сред джендемите. Това място беше най-страшно. Тук пътят се вглъбяваше навътре вдола, извиваше се по едната и по другата страна, чертаяше две дъги, два обрачена капан, в който много хора бяха намерили смъртта си.
staroplaninskilegendi_01_yovkov_0012|И както правяха и друг път, хайдутите препречеха пътя, изправиха се там, страшни, брадясали, наметнети с черни арнаутски гугли, отрупани с уръжие.
staroplaninskilegendi_01_yovkov_0013|Жените се показаха на завоя и щом ги видяха, спряха се като втрещени.
staroplaninskilegendi_01_yovkov_0014|После се втурнаха, едни надолу, други нагоре и започнаха да бягат, но краката им се подкусяваха и те само лъкотушаха на едно място като ударени птици.
staroplaninskilegendi_01_yovkov_0015|Премалели от страх, те паднаха на земята и заплакаха.
staroplaninskilegendi_01_yovkov_0016|Хайдутите не се трогнаха, те дори не ги погледнаха.
staroplaninskilegendi_01_yovkov_0017|Тяхното внимание беше друга де. Една жена стоеше още на пътя, млада, хубава. И как беше пременена! Синя Джанфезена Рокля е леча от Аленът лаз, пъстра божи гробска престилка, сребърни пафти, а на шията и тежки нанизи, ред Едриълтъни, ред Рубета и Махмудии. Къде беше тръгнала та и на Труфена? На сватба ли? Лут ли беше той баща, който беше я пуснал сама и сега?
staroplaninskilegendi_01_yovkov_0018|Шибил пристъпи по-напред. Умата го гледаше спокойно и право в очите. Една отвесна черта беше се спряла между гайтанините и вежди. Алините й усни потръпваха.
staroplaninskilegendi_01_yovkov_0019|Брей, извикът е крехкият ти глас странно прозвуча сред плача на жените. Да си вървите по работата, че знаете ли се? Не ви ли е срам? Какво искате от едни жени?
staroplaninskilegendi_01_yovkov_0020|При тя домиха идутите, които не снимаха очи от алтъните на шията ѝ, се спуснаха към нея и отдалеч протегнаха жилистите си ръце.
staroplaninskilegendi_01_yovkov_0021|Ще би е лмахна с ръка и ги спря. После се обърна и справи се на целия си ръст и от високо измери с очи момата. Какво бяло лице! И тънкав кръста, а полите й широки като на кукла. И какъв кораж!
staroplaninskilegendi_01_yovkov_0022|Очите му заблещаха весело надолу насмях.
staroplaninskilegendi_01_yovkov_0023|Но по-рано от него момата беше си размяла с глас. Лицето й светна, стана по-хубава и сега можеше да си види, че очите й са сини и зъбите бели. Шибил я гледаше очуден. Какъв ще е той дявол?
staroplaninskilegendi_01_yovkov_0024|Как стана всичко, но това, което отпосле се случи, ще бил сам не можа да разбере.
staroplaninskilegendi_01_yovkov_0025|Жените се съвзеха и макар още плахи като кушути надойдоха към него.
staroplaninskilegendi_01_yovkov_0026|Разведри се сякаш планината, долу се зачуда шуми реката, в гората се обади птиче. Сам Шибил беше седнал на един камък, усмихваше се, слушаше братвежите на момичето.
staroplaninskilegendi_01_yovkov_0027|Какво приказваш е то?
staroplaninskilegendi_01_yovkov_0028|Един Господ знае думи, които не значат нищо, думи, които се забравят. Но как светеха очите й и как беше приятно да я гледа човек.
staroplaninskilegendi_01_yovkov_0029|Настрана, окрутени като по някое чудо, хайдутите бяха насядали и спокойно пушеха.
staroplaninskilegendi_01_yovkov_0030|— Та ти си велико кехайово, момиче! — говореше Шибил. — Рада се казваш. Че как те я пуснал баща ти, и пре мене на салтани с тия върви и махмудии, аз ще ги взема. — Бре, ще ги вземеш. Я да ми дадеш още, че ми са малко. Явиш? — извика тя като показваше с ръка. — Явиш как ти се скъсал ръкава. Чакай, аз ще го зашия.
staroplaninskilegendi_01_yovkov_0031|Ше бил поглед на ръката си сложена върху тапанджата на пушката. Червеното съкно наистина беше се скъсало. И преди той да разбере шегува ли се тя или не, видя я току пред себе си, виждаше маха на бялото й лице, червените й усни и когато го погледнеше, очите й го заливаха с мека и сладка светлина.
staroplaninskilegendi_01_yovkov_0032|Осмихваше се и го гледаше диволито. Прибираше скъсения ръка, във устата си държаше игла и конец.
staroplaninskilegendi_01_yovkov_0033|Не мърдай, сгълча го тя. Започвам. И тури нещо в устата си да не ти зашие и ума, барем да го имаш.
staroplaninskilegendi_01_yovkov_0034|Засмяха се всички. Слушай, продължаваше Рада, да се ожениш, че да има кой да те кърпи, да не ходиш такъв окъсан като... Като какъв? Като циганин.
staroplaninskilegendi_01_yovkov_0035|Шибил се понамръщи. Жените плахо се спогледаха. – Да се оженя, каза Шибил. – Ама момите не ме искат. – Ба, ще те искат, такъв ерген. – Е, хайде, вземи ме ти. – Кой? Аз ли? През дол бяга, цървул стяга. – Што е то? – Хайдутин. – Не, не ми трябва. – Хайдутин не искам.
staroplaninskilegendi_01_yovkov_0036|Шибил пак се намръщи. Рада срещна у молителните очи на жените и бързо рече да се поправи.
staroplaninskilegendi_01_yovkov_0037|Може, може, земвам те. Трябва само да питаш велико кихая.
staroplaninskilegendi_01_yovkov_0038|и като помълча малко тя прибави. И кърсер дари на Мурат Бей.
staroplaninskilegendi_01_yovkov_0039|Готово! Виж ли как го заших?
staroplaninskilegendi_01_yovkov_0040|Каза те и по снаръкава, да ме помниш, да го носиш поживо, поздраво.
staroplaninskilegendi_01_yovkov_0041|Шибил ий погледна и се засмя. Те попреказваха още. После жените си тръгнаха и Шибил ги придружи чак до там, дето се свършваше гората и започваше полето.
staroplaninskilegendi_01_yovkov_0042|Когато се случи това беше пролет. Туктаме само издолищата беше се раззеленила прясна букова шума, а по другите дървета имаше само пъпки.
staroplaninskilegendi_01_yovkov_0043|Шибил се връщаше в планината и още се усмихваше. След него вървяхаха идутите, гледаха в земята и мълчаха. Черен гарван пролетя над тях изъграка. Лош знак.
staroplaninskilegendi_01_yovkov_0044|Ши бил незабелязан, но хайдутите се събраха накуп и си зашушнаха нещо. Жена беше се изпречила на пътя им, обава жена, а всичко това не предвещаваше нищо добро.
staroplaninskilegendi_01_yovkov_0045|Мина се още някое време, стопли се повече. Цъфнаха дивите сливи, разлистиха се крушите и един ден, сред топлия въздух и сред слънцето, закука куковица.
staroplaninskilegendi_01_yovkov_0046|Както беше обичай, Шибил започна да брои, за да види колко години ще живее, но после се замисля за възрастта си и му се стори, че е вече стар.
staroplaninskilegendi_01_yovkov_0047|Вспомни си радостю смихно.
staroplaninskilegendi_01_yovkov_0048|Каква чудновата бърканица, мислеше си той, от жена, дете и дявол. И как всичко й прилича, каже нещо, умно е. Направи нещо, хубаво е.
staroplaninskilegendi_01_yovkov_0049|И той е виждаше тъй както беше я видял, когато държаше иглата с конеца в устата си, гледаше го и се усмихваше.
staroplaninskilegendi_01_yovkov_0050|Не игла, помисли си пак ще би ли въздъхна. Нож може да държите и в устата си и от той нож човек на драго сърце би умрял.
staroplaninskilegendi_01_yovkov_0051|Тък му в това време минаха търговци и хайдутите ги спряха. Изплашени, прежълтели като смин, те едва се крепяха върху седлата на конете си и чакаха да чуят какво ще речеше Бил.
staroplaninskilegendi_01_yovkov_0052|но Шибил не ги накара да отворят десагите си и да потърси какво има в кемерите им. Отдалеч той отваря приказка за Туи и за Оной, споменава за Велико кехая и най-после заговорва за Рада.
staroplaninskilegendi_01_yovkov_0053|Пойдуйте те гледат в земята и изгарят от срам.
staroplaninskilegendi_01_yovkov_0054|Шибил пуща търговците да си вървят и спраща ги до нея и да я високо им заръчва да носят много здраве нарада.
staroplaninskilegendi_01_yovkov_0055|Хайдутите вече не продумаха на Шибиля, нито смеяха да го погледнат в очите. И когато вечерта се прибраха в планината навърха с сините камъни, между орловите гнезда, и Шибил си легна и заспа, те останаха около огъни и си приказваха.
staroplaninskilegendi_01_yovkov_0056|Планината си беше същата, обежището им беше сигурно. И все пак те бяха неспокойни и плахо се оглеждаха наоколо. Изкрещи някъде лисица, стори им си, че човек кашли. Изпука някоя съчка, мислят, че е иде някой.
staroplaninskilegendi_01_yovkov_0057|И те поблизо се навеждат един към друг, шепнат си и гледат как Шибил се върти в съня си, как пъшка и приказва нещо. Тогава те станаха и се застягаха за път. Не го убиха, но избягаха от него, както се бяга от Чумъв.
staroplaninskilegendi_01_yovkov_0058|Шебело стана сам.
staroplaninskilegendi_01_yovkov_0059|И тогава парите от царските хазни, които беше обирал, пръстените измъкнете от ръцете на живи и на умрели, златото и среброто от черкви и монастири, всичкото имане, което той беше натрупал и беше скрил из пещери и хрълупи, всичко това потече в къщата на Велико Кихая, все подарат си на рада.
staroplaninskilegendi_01_yovkov_0060|Скъпи подаръци за всяко много здраве от нея. Но ето, той получи хабер, който го замая.
staroplaninskilegendi_01_yovkov_0061|Рада го викаше да слезе в село.
staroplaninskilegendi_01_yovkov_0062|Баща им даваше благословията си, Мурад бе им упрощаваше.
staroplaninskilegendi_01_yovkov_0063|И в знак, че думата му е вярна, Кърсер Даридът му пращаше божи гробски бройници от Кихлибар.
staroplaninskilegendi_01_yovkov_0064|Дълго време ще бил мисли дали това не е примка. Всичко, което имаше, беше годал.
staroplaninskilegendi_01_yovkov_0065|А гората беше се раззеленила вече цяла, натежаа и потъмняа, поляните се покриха с висока трева, цъфна божурът, цъфна и росенът, самодивското цвете.
staroplaninskilegendi_01_yovkov_0066|Издолищата се понесе дъх на люляка и на липи.
staroplaninskilegendi_01_yovkov_0067|И когато фосоите проехтяреват на рогач, а в старата кория заглукаха гриви гълъби, корав се стори на шибеля камъкът, на който вечер слагаше главата си и тежка му се видя пушката. Той повече не можеше да трае и тръгна за село.
staroplaninskilegendi_01_yovkov_0068|Когато потегли от сините камъни беше пладни, когато слезе долу на пътя и се обърна назад, върховете на планината и канарите по тях бяха се зачервили от зализа на слънцето.
staroplaninskilegendi_01_yovkov_0069|Но орлите още се виеха пред белите сипе и камените стени на орлите. Тие орли, които бяха навикнали на леш и които често пъти, кацнали на някоя скала, рваха човешки меса.
staroplaninskilegendi_01_yovkov_0070|Мръкваше се, вдалищата се спускаше синкава мъгла, побаирите лазеха дълги сенки.
staroplaninskilegendi_01_yovkov_0071|Планината беше се спотеила, тиха, замислена, сякаш гледаше след чебилия и питаше, къде?
staroplaninskilegendi_01_yovkov_0072|Домъчня му на Шибиля, съмнението като черве изъгриза сърцето му.
staroplaninskilegendi_01_yovkov_0073|Той се дна на един камък и се замисли,
staroplaninskilegendi_01_yovkov_0074|и всичко пак прекара през ума си всичко премисли.
staroplaninskilegendi_01_yovkov_0075|Когато повдигна очи, месецът беше изгрял.
staroplaninskilegendi_01_yovkov_0076|Друг свят виждаше пред себе си Шибил и друга беше станала планината, разтлана на широко, мътна, изгладена като синя стена, загърната в бяло було.
staroplaninskilegendi_01_yovkov_0077|В черни сенки се спотайваха горите, от поляните идеше хлад и бяла мъгла пъпляше по тях и се извиваше като змей.
staroplaninskilegendi_01_yovkov_0078|Някъде в мрака светваше светулка, написваше с огнена черта някакъв знак, някаква тайна дума и угасваше.
staroplaninskilegendi_01_yovkov_0079|А дълбоко вдола нещо пееше. Реката ли беше това? Пееше тъй тихо, тъй хубаво.
staroplaninskilegendi_01_yovkov_0080|ще бил гледаше пред себе си и мислеше.
staroplaninskilegendi_01_yovkov_0081|В очите му като къси жълти жици се чупиха лъчите на месеца, изкряха и се сплитаха в някакъв смътен образ, който то се явяваше, то се изгубваше.
staroplaninskilegendi_01_yovkov_0082|Но ще бил ясно виждаше две очи, които го гледат, една усмивка, която го мами.
staroplaninskilegendi_01_yovkov_0083|Той стана. Тръгна подири тези очи и тази усмивка и повече не се обърна назад.
staroplaninskilegendi_01_yovkov_0084|Три предпазливи удъра, тихо пошепнато. Аз съм Мустафа.
staroplaninskilegendi_01_yovkov_0085|Вратата се отваря и той влиза в бащината си къща.
staroplaninskilegendi_01_yovkov_0086|На огнището гореше огън, сенки играеха по стените. По главите на пищовите на Шибиля, по паласките и пискюлите на волията му блясват отражения. Висок и снажен, къщата сякаш беше тясна за него. Той срещна очите на майка си и разбрав всичката тревога, която я мъчеше.
staroplaninskilegendi_01_yovkov_0087|«Мустафа», каза тя, «защо дойде? Ще идеш ли там?» «Ще ида». «Ще идеш? Кога?»
staroplaninskilegendi_01_yovkov_0088|Утре.
staroplaninskilegendi_01_yovkov_0089|Старата жена познаваше добре си нас и знаеше, че е излично да настоява, да го раздумва.
staroplaninskilegendi_01_yovkov_0090|Тя седна край огъня, обхвана с ръце коленете си, потопилче вземята и зареди.
staroplaninskilegendi_01_yovkov_0091|Мустафа, от три дни сеймените на Кърсердара леят куршуми и точат ножовете си. Опитват ги с пръст да видят дали са остри. Косъм да спуснат върху тях, косъма ще разсекат. И сучат мустаците си и гледат към нас. Мустафа, нещо лошо има да стане.
staroplaninskilegendi_01_yovkov_0092|Шибил се обърна и я погледна, но погледът му беше такъв, че тя не знаеше дали той беше я чул и дали беше я разбрал. Тя се спотаи и не каза вече нищо.
staroplaninskilegendi_01_yovkov_0093|А Шибил се разпасваше и сваляше от себе си пищови с позлатени дръжки, кулакли и ножове, работени с ребропаласки, всичко това, което за него беше вече тежко и непотребно време.
staroplaninskilegendi_01_yovkov_0094|Горе, на черковното кафене до разтворения прозорец седят кърсердаринът Морат Бей и Велико Кихая. Бей е темнамръщен, мълчи и замислено смуча чибука си. Но Велико Кихая е весел, той ходи из стаята, размята дъното на широките си шалвари, час по час вади от пъстрия си купринен пояс, голям като топка часовник, поглежда го и пак го скрива. После потрива ръце и дума. «Всичко е наредено, Бей ефенди, гледай си работата.
staroplaninskilegendi_01_yovkov_0095|На масата пред кърсердарина са сложени две кърпи – бяла и червена. Това са условните знаци за сеймените скрити в посия. Ако беят развео от прозореца бялата кърпа, това значеше милост. Ако развееже червената, значеше смърт.
staroplaninskilegendi_01_yovkov_0096|и те чакат и поглеждат към улицата.
staroplaninskilegendi_01_yovkov_0097|Никой не се вижда. На портата не е излязла Рада, нито Мустафа се вижда да иде. Велико Кихая не може да се стърпи и се завтича до къщи.
staroplaninskilegendi_01_yovkov_0098|Е? Пита беят, когато той се връща. Всичко е наред. Облякла се в най-хубавата си премяна, а али надлазен е лек, синеджен фезе на Рокля. Същота и както беше се облякла, когато я пратихме в планината. И жена на Лие, гледа се в огледалото, пише веждите си и се смее.
