staroplaninskilegendi_03_yovkov_0133|Какво искаш, изманка той? Не може, тук не може, хора има тук.
staroplaninskilegendi_03_yovkov_0134|А аз мечка ли съм? – рече Косан. – Ах, Косан! Косан! – викаше Ранка. – Божичко, как ме оплаши! – Аз съм Ранки. – Какво има? Що ще еш тука?
staroplaninskilegendi_03_yovkov_0135|И без да обръща внимание на Калугира, Косан беше вече при Ранка, усмихваше се. Слушаше я, залени той и тя от светлината на огъня. С малко думи, като преживяваше отново всички страхове, Ранка му разказа за бягството си. Драгота беше я спасил.
staroplaninskilegendi_03_yovkov_0136|Само, че сега трябвало да бъдат вкъщи, а Драгота я превел през манастиря, като й казал, че от тука било по-близо.
staroplaninskilegendi_03_yovkov_0137|Поблизо от тук, рече Косан, не е право, лъже. И без да погледне драгота той седна при рънка.
staroplaninskilegendi_03_yovkov_0138|Ех, Ранки, кой е мислил, че ще се срещнем? И сега, тая вечер, мене ме гони потеря. Ама нищо.
staroplaninskilegendi_03_yovkov_0139|— Гони Депутерия! — извика Драгота и дойде при Косана. — Човече, бягай оттука! Иди си! Иди си, ще ни погубиш! По-пе стой мирно! Рече Косани пренебрежително го бутна с ръка. Не викай! Ако дойде Депутерия, страшно е и за мене, и за тебе! — Човече, ще ни погубиш! — викаше Драгота. — Иди си! Иди си по-скоро!
staroplaninskilegendi_03_yovkov_0140|Косан го изгледа с твърдите си очи, помълча и рече. — Слушай, попли си или дявол не искам да те зная. Да се махнеш от очите ми. Иди и кажи на Димчък и Хая, че Косан ще доведе дъщеря му. Кажи на Марга. Кажи ако искаше на Хаджи Емин да дойде да я вземе. Хайде, върви!
staroplaninskilegendi_03_yovkov_0141|И той сложи тежката си ръка върху шията на Драгота и го затласна към вратата. Ранка изпища. Косан видя отблизо очите й. Тежките й плитки се разлюляха пред него. Той пусна Драгота и се повърна. На Бога служиш, а? Извика той. Зная те аз тебе. Зная какво беше намислил да правиш, ама това няма да стане. Не, Косан е тук.
staroplaninskilegendi_03_yovkov_0142|Претия домиранка трепна.
staroplaninskilegendi_03_yovkov_0143|Много неща й станаха ясни, едвам сега тя разбра голямата опасност, която я заплашваше. Сама, сред тая гора, между тия страшни мъже.
staroplaninskilegendi_03_yovkov_0144|Все пак повече си боеше от дръгота, отколкото от косана.
staroplaninskilegendi_03_yovkov_0145|Тя седна пак при Огъня, седна при Нея и кусан.
staroplaninskilegendi_03_yovkov_0146|Той не поглеждаше вече драгота. За него драгота като че не съществуваше. И ставаше по-весел, приказваше на ранка, по-близо сядаше до нея и по-отблизо гледаше очите й. Настрана стоеше драгота и го гледаше изпод страшните си вежди. Сянката му, голяма и черна, стоеше наред с него до стената.
staroplaninskilegendi_03_yovkov_0147|Колко време беше се минало, никой не знаеше. Косано сети, че някой беше дошъл зад него и се обърна. Беше драгота.
staroplaninskilegendi_03_yovkov_0148|Друг да беше, би се оплашил от погледа му. Но Косан се засмя и както по-рано нехайно го бутна назад с ръка.
staroplaninskilegendi_03_yovkov_0149|Всякъж звяр изрева и драгота се хвърли върху косана, впират се в шията му. Но кора вбеше хайдутинът, извисе и прихва на драгота. И почна се борба страшна, яростна и бясна. Двамата мъже се вкопчваха един в други, ставаха и падаха, събаряха всичко около себе си, ръмжаха, дишаха тежко.
staroplaninskilegendi_03_yovkov_0150|Ранка избяга навън.
staroplaninskilegendi_03_yovkov_0151|Тя претърча през двора, но срещна тъмнината на гората, оплаше се и се повърна. Зачупи ръце. Заплака.
staroplaninskilegendi_03_yovkov_0152|Погледна през вратата. Лицето на Калугира беше цяло в кръв, но в ръката му лъсна нож. Огънят беше разпилян. Гореше вече стаята. Обезумяла от страх, Ранка помисли пак да бяга.
staroplaninskilegendi_03_yovkov_0153|Светлината, която заливаше двора, тя съгледа желязното клепало, овиснало на чердака. Тя се спусна, грабна железния чук и започна да удре по него. Бързи, тревожни звуци забягаха към тъмнината на гората, сподирени от искри и дим. Манастирят вече гореше. Ранга чувстваше, че ръката й отмалява, но продължаваше да удре клепалото.
staroplaninskilegendi_03_yovkov_0154|Чу се звънна копита по камените плочи и тя се обърна.
staroplaninskilegendi_03_yovkov_0155|Сияните на пожара, като по бял ден се показаха джиемин на белия си кон.
staroplaninskilegendi_03_yovkov_0156|Той слезе и първото нещо, което направи бе да съблече дрехата си и да я хвърли върху ранка.
staroplaninskilegendi_03_yovkov_0157|Никой не трябваше да види лицето на жена му. Дворът се изпълни с конници. Това беше цялата потеря, което преследваше Косана. Смаяни от пожара, смаяни още повече, че виждат ранка, която, макар и заболена, познаха веднага, те се тълпяха гъсто един зад друг и сиянето на пожара грееше в зениците на очите им, заливаше лицата им на страхналите им коне.
staroplaninskilegendi_03_yovkov_0158|Отвесно и право стърчаха дълги пики, плащяха криви саби. И всички гледаха към султана и чакаха какво ще каже. А султанът стоеше до ранка, загърната в жълтата му отлазена дреха, понавеждаше се към нея и даваше охона на това, което тя ниско му говореше.
staroplaninskilegendi_03_yovkov_0159|После той се изправи и даде някаква заповед. Два мъдуши скочеха от конете си, минаха през сиянието на пламъците, изгубиха се в дима и влязоха в килията, където бяха косани драгота.
staroplaninskilegendi_03_yovkov_0160|Извадиха двама мъже, полуобгорени, кървави, мъртви, но още вкопчени един в друг.
staroplaninskilegendi_03_yovkov_0161|Разделиха ги и ги простряха върху камените плочи на двора. С мъжествени и тежки стъпки султанът отиде при тях. Спря се най-напред при драгота, но лицето му се сбърча от отвращение, ритна го с крак и го отмина.
staroplaninskilegendi_03_yovkov_0162|Отиде и се спрена трупа на Косана. Сиянието на пожара го огряваше.
staroplaninskilegendi_03_yovkov_0163|Без върхната си дреха Хаджи емини изглеждаше още по-тънък и по-строен. Отпред на зелената му чалма старчеше пълно в оперо.
staroplaninskilegendi_03_yovkov_0164|И като прихвана, както му беше обичай, с ръка червеникавата си брада, той се понаведе и се загледа в коса на, все тъй голям и страшен, какъвто беше и приживе.
staroplaninskilegendi_03_yovkov_0165|и дълго стоя над него замислен.
staroplaninskilegendi_03_yovkov_0166|Минаха се повече от двайсет години. На мястото, гдето беше клепало топоник на Бурен и Куприва. Никой не помисли вече да отнема ранка от ръцете на Хаджи Емин. Никъде не я пущаше. Никой не можеше да я види. Умря бащай. Султанът не се смели и не я пусна. Минаха още няколко години. Помина се и Марга. Всякаш някой вековен дъп се строполи и падна. Заговориха за покойната всички. Запомнил я бе и Хаджи Емин.
staroplaninskilegendi_03_yovkov_0167|Той спрати с нея двамата си сина, родени от нея, двама снажни, яки момци.
staroplaninskilegendi_03_yovkov_0168|Единът вървеше от едната страна на майка си, другия от другата.
staroplaninskilegendi_03_yovkov_0169|Тебя ханай верната и стража.
staroplaninskilegendi_03_yovkov_0170|Край на най-верната стража.
staroplaninskilegendi_04_yovkov_0000|Божура от Старопланински легенди на Йордан Йовков. Записано за LibriVox.org. Записът е обществено достояние.
staroplaninskilegendi_04_yovkov_0001|Ова я, че шмана Хаджи Влъка, син Пенов, беше о лето 1783.
staroplaninskilegendi_04_yovkov_0002|Надписният начишма.
staroplaninskilegendi_04_yovkov_0003|Калуда циганката продаваше древни неща, които повече й служиха да прикрива с тях просията си – бяла и червена пръст, хума, сухи дренки, вратена.
staroplaninskilegendi_04_yovkov_0004|Всичко това се продаваше мъчно. Жените се пазаряха, даваха малко, а някои съвсем не купуваха. Но старата циганка беше забелязала, че работите отиват по-добре, ако с нея биваше и дъщеря, и божура.
staroplaninskilegendi_04_yovkov_0005|Когато Божора беше малка и ако беше студено, зъзнеше с целото си тяло, тъй както майка и беше я научила, жените се показваха трогнати. Същност под това съжаление се криеше очудването им, че това хубаво дете може да бъде на една циганка. Но Божора сега беше мума. Големите черни очи на предишното си морничево циганче гледаха дръско, дяволито, снагата й беше се източила, тънка, гъвкава, разцъфнала като дива шипка.
staroplaninskilegendi_04_yovkov_0006|А Божура като че пощуряваше, очите й светеха, снагата й не чувстваше тежеста на дрехите. Жизнерадостна като овошките, пияна от слънцето, като пчелите, които бръмчаха около цвета на ябълките. Те тичаше по съседните къщи, размиваше старците, играеше с децата, влачеше след себе си въздишките и запалените погледи на младите цигани.
staroplaninskilegendi_04_yovkov_0007|Не помагаха нито молбите, нито заплашванията на Калуда. Вдигаше се кавга, каквато можеше да се чуе само в една циганска къща. И ако най-после майка й можеше да я придума, това най-често ставаше като й обещаеше, че ще идат охаджи вълкови.
staroplaninskilegendi_04_yovkov_0008|Божоро обичаше да отида в тая къща.
staroplaninskilegendi_04_yovkov_0009|Когато беше малка и заловена за роклята на майка си, влизаше в широкия двор, обграден с високи довари, очите й се оголемяваха, чудеше се на старите чимшири, на асмата, на босилика, поникнал между каменните плочи. А когато срещу някой празник се случаше да я изнесе на цялата покъщина навън, тогава ярките буйни килимите и губерите, сърмата и атлазът на скъпите премени, всичкото това богатство я замайваше.
staroplaninskilegendi_04_yovkov_0010|И все пак тя най-много се чудаше на пембените вейки на Божи-гробската върба, това чудно дърво, което само Хаджи Вълко имаше в двора си. Сега Божура влизаше в двора на Хаджи Вълка весела и спокойна и не поглеждаше нито чимширите, нито Божи-гробската върба. Тя идваше тук зарад Ганаила, дъщерята на Хаджи Вълка. И ако съзнанието за хубостта си, което имаше, я караше да гледа на всички други жени с пренебрежение и отвисоко, при Ганаила и сеструваше, че иде като прирав
staroplaninskilegendi_04_yovkov_0011|Божура я смяташе за най-хубавата мума. Чудно й беше само защо Ганаила не се гордееше с хубостта си, като че не я забелязваше. Тя работеше, а изглеждаше отпусната и ленива. И без да се грижи за себе си, без да иска, разхубавяваше от ден на ден, понапълняваше, снегата изрееше и се наливаше като плод.
staroplaninskilegendi_04_yovkov_0012|Не можеше да се каже, че Божора я обича. Божора не обичаше никого и към нищо не можеше трайно да се привърже. Но у Ганаила тя виждаше всичко, което сама тя нямаше, а искаше да има. Харесваше бялата й като мляко кожа, русите й коси. Чудеше се на тая чиста, благоуханна плът спотаяна в меките гънки на куприната. И ако всичко това беше нещо, което можеше да се открадне, тя би го откраднала на драго сърце.
staroplaninskilegendi_04_yovkov_0013|Понякога тя се заглеждаше в ганаила. Гледаше авторачено и лукаво, но в същото време въздоржено и занесено, както дивакът гледа из тукана си. Очите й горяха. Мълчеше. После, предпъзливо, като че се боеше да ни причини болка, гладаше с коравите си пръсти бялата и заголена долакът ръка и шепнеше. Каква си ма? Бяла, бяла. Каква си хубава.
staroplaninskilegendi_04_yovkov_0014|Ганила се смеща.
staroplaninskilegendi_04_yovkov_0015|А Божура си беше цигънка и той е избликна искрена нежност не искаше да отиде тук у тъй. Изпросваше си някоя стъкле на гривна, някоя износена дреха. И тъй като с милостта й растеше, откъсваше си сама най-хубавия карамфил и накичена с него оглеждаше се наедно с ганейла в стъклото на прозореца.
staroplaninskilegendi_04_yovkov_0016|В това време Хаджи Вълковица се потъкмяваше с калуда. И още с гребачев ръка, с който си беше изнесла брашно, старата жена поглеждаше двете момичета със своя кротък, извиращо дълбоко поглед и се усмихваше. Вън беше и Хаджи Вълко, висок, побелял, важен като цар. Той наглеждаше дилгерите, които копаяха в двора и слагаха червени кюнци. Хаджи Вълко правеше чешма в двора си. Едничкото нещо, което още липсваше на славата му.
staroplaninskilegendi_04_yovkov_0017|Едно нещо не можеше да разбере Божура. Хубава беше Ганаила, но защо от толкова време на сам тя връщаше всички, които бяха дохождали да я искат? Кого чекаше Ганаила? За кого се надяваше?
staroplaninskilegendi_04_yovkov_0018|Божура ходеше из цяло село, знаеше всички клюки, всички сплетни. Знаеше какво говори за Ганаила, за кого е такмет. Тя разбираше тие тайни, радваше им се като че се отнасяха за нея. И когато някой ден дохождаше и спрекажаше всичко на Ганаила, струваше и се, че са я ограбили. Замълчаваше и чакаше да види какво поне ще каже Ганаила.
staroplaninskilegendi_04_yovkov_0019|Но дъщерата на Хаджи Вълка оставаше все те отпусната и равнодушна, каквато си беше винаги. Тогава очите на циганката пламваха от страшна омраза. Една хилядна частица само от това, което беше и казала, можеше да направи самата нея частита. А тая бяла кукла като че ли имаше в градите си не сърце, а камък.
staroplaninskilegendi_04_yovkov_0020|Веднъж, над вечер, Божора и Майка й се връщаха от гората. От към противоположния край на селото, отвъд къщите, по пътя който излизаше иззад баиря и сечеше зелената поляна под кориите, се показаха два маконника.
staroplaninskilegendi_04_yovkov_0021|Бяло облаче дим се появи над тях, чу се гармеж. Кониците като че се плъзгаха към селото, още две бели облачета се появиха над тях и урвите при старче повториха други два гармежа. По стар обичай, пътниците обаждаха с гармежи, че си идат.
staroplaninskilegendi_04_yovkov_0022|Само това си помислиха майката и дъщерята и го забравиха, уморени от пъти от тежката пръст, с която бяха задянати.
staroplaninskilegendi_04_yovkov_0023|Когато влязоха в село, беше вече тъмно и първото нещо, което забелязаха беше, че по всички порти бяха неизлезли жени. Калуда вървеше напред, не обръщаше внимание на жените и ако поглеждаше наляво и надясно, гледаше да види дали не е забравено някъде нещо, за да го пъхне под престилката си.
staroplaninskilegendi_04_yovkov_0024|Поназад след нея идеше Божура. Товарът й ни най-малко нея превиваше, снагата й се оставаше права и гъвкава, като стълбица на вихрушка.
staroplaninskilegendi_04_yovkov_0025|Беше вече тъмно, но очите й от време на време проблясваха. Цялата сюрия дичурли гатичаха подирне и викаха, Божуро, Божуро, дай ни Божур, Божуро! Хайде, бре! Викаше тя весело и без да се сърди. Отде ще ви взема Божур?
staroplaninskilegendi_04_yovkov_0026|И като оставяше децата да си викат колкото си щат, тя се спираше в тъмнината и слушаше какво приказват жените.
staroplaninskilegendi_04_yovkov_0027|На едно място тя чу, че споменават все едно и също име – Василчо. На друго приказваха пак за тоя Василча, изреждаха роднините му, богатствата му. На трето, освен Василча споменаваха и името на Ганаила – Божура Дадеохо.
staroplaninskilegendi_04_yovkov_0028|Няма да го бъде, не! Говореше една и божура позна жечевица, тая, която винаги носеше голям здравец на ръченика си и много знаеше. Няма да го бъде, помнете ми думата. Не другия хаджи вълчо ще даде дъщеря си на того спиение, Василча.
staroplaninskilegendi_04_yovkov_0029|Любопитството на Божора растеше.
staroplaninskilegendi_04_yovkov_0030|Като преминаваше от една купче на жени на друга, все скрита в тъмнината на стрехите, тя неочаквано се узова при Бончо Вияхан. Ярка, жълта светлина излизаше от прозорците и от вратата и цепеше тъмнината на две. Два маконника стояха там и то се губяха в мрака, то излизаха на светло. Божура се притаи до Довара. Ко е Василчо? Не ще да е той въз стар човек, когато виждаше сега.
staroplaninskilegendi_04_yovkov_0031|Но ето в мрака се разигра кон. Зазвъниха подкови по калдарама и сред светлината се показа други конник. Черен, разлютени лъснат от под беше конят му, разпуснал тежка грива. Сам той беше млад, левент, с розперчен поднакривения кълпак, с развени чепкени отзад.
