staroplaninskilegendi_06_yovkov_0054|Колкото и да заничеше, баба Анна не можа да види къде си изгубиха изовошките на градината Марин и Женда. Видя ги когато приказваха, той от сам, тя отвъд плета. Видя ги и в градината, но после ги изгуби. Малко по-късно видя Марина на чешмата. Той пи вода, изтри се с ръкава си, като че забравил ръката на устата си, загледа се към воденицата. Весел, но някако чуден и изненадан. Около воденицата ходеше пръчът, но Марин нито го погледна.
staroplaninskilegendi_06_yovkov_0055|След като пи още веднъж и два жвода, той метна на рамо гегата си, изплодирен от кучетата си, тръгна нагоре към габара, където едвам се дочуваха звънците на козите му.
staroplaninskilegendi_06_yovkov_0056|Една до друга бяха постоловите воденици. Един и същи човек, някой си постол, когато бяха забравили вече, беше ги правил някога, но орисията им не беше същата. Едната работеше ден и ноще, бухтеше колелото й. Водата се плискаше и шумеше. Цялата воденица се тресеше като че ще се пръсне. Другата мълчеше. Водата се разливаше настрана. Корубистиято лук съхнеше и се пукаше.
staroplaninskilegendi_06_yovkov_0057|А Жен да не се спираше на едно място, ако не беше в градината, отиваше на чешмата, понякога пък грабваше хурката, подпасваше я на пояса си и тръгваше през поляните, върви и преде. Роменее си лицето и сред жегата, очите й се тъмнеят, сякаш черни сливи, кога зреят на слънце, висят отзад дългите и плитки.
staroplaninskilegendi_06_yovkov_0058|Отдалеч личиче се подсмива и сякаш не предея разсуква нишки след себе си, отдето помине, плете мрежи като паежина.
staroplaninskilegendi_06_yovkov_0059|Баба Ана я гледа и клати глава. Примки е турила навсеки пъти пътека, мисли си тя. Магия е наляла в чешмата, чума да я тръшни.
staroplaninskilegendi_06_yovkov_0060|Всичко се обърна на опъки. И по-рано минаваха пътници, отбиваха се на чешмата, но щом пиеха вода, тръгваха пак по работата си. Сега който пиеше вода, не бързаше да си ходи. Бавяха се търговци, джелепи и бегликчии. Изъжаваха се под сенгите, протягаха се, ходеха замаяни като слънчасали и тук поглеждаха под дириженда.
staroplaninskilegendi_06_yovkov_0061|Изведнъж гората екваше от звънци и като змей, донесен от Вихрушка, появяваше се Марин. Той отива право при Женда. Тя му приказва, смее се, но Козарят отвръща по тъмнялото си лице и поглежда пътниците.
staroplaninskilegendi_06_yovkov_0062|Погледите му тежат като камъни. Някои се досещат и си тръгват, други се бавят, пият на чешмята без да са жадни. И тогава Марин налита на тях.
staroplaninskilegendi_06_yovkov_0063|Тук не е беглишки, че и да си пасете кунети, вика им той. И ни имаме добитък, тревата трябва и на нас.
staroplaninskilegendi_06_yovkov_0064|И той размахва гегата си, ръкавите му се свличат и показват жилистите му ръце, под късия му кожух обърнат с козината навън лъсват пищови и ножове, набучени в селяха му.
staroplaninskilegendi_06_yovkov_0065|Не струваше да се заяда човек с тоя едър, полудив козар с широки плещи и увиснили мустаци.
staroplaninskilegendi_06_yovkov_0066|и бекликчеите на пети хора с сърмени джебкени и потури от синя чоха отстъпяха.
staroplaninskilegendi_06_yovkov_0067|Разкопчаваха букаите на конете си, качаха си, като поглеждаха още веднъж към Женда, заминаваха си.
staroplaninskilegendi_06_yovkov_0068|Веднъж минаваха кирвънджии. Случи се, че тъкмо тогава зад планината се беше повдигнал тъмен облък, святкаше се и прогърмяваше.
staroplaninskilegendi_06_yovkov_0069|Но когато колята на керванджиите се заспущаха надолу из урвата при Белия сипей, не можеше вече да се разбере дали на небето гърмеше или гърмяха колялата на кервана. Опъваха се назад големите биволи, размахваха извитите си рога, керванджиите викаха. Извисеви хрушка и повдигна прах от една крайна кервана до другия. Бурета и тъмният облак се изместиха назад. По-страшен изглеждаше сега керванът, който идеше.
staroplaninskilegendi_06_yovkov_0070|Като навалиха по урвата и минаха на срещната страна, колята бавно се проточиха в дълга върволица. Спряха се до водениците. Поляната се изпълни с коля и с биволи. Капнаха само няколко капки. Облакът отмина. Припече слънце и стана още по-горещо. Херванджиите грабнаха котли и заплискаха с вода биволите. После откачиха катраниците и се заловиха да мажат колята си.
staroplaninskilegendi_06_yovkov_0071|Показа се Женда. Тя отиваше на чешмата, пазеше си и бягаше то от един, то от други бивол. Кирвънджиите пуснаха катраниците и се загледаха. Женда наля вода, после пак се върна. Тогава кирвънджиите грабнаха големите си бъкили и се натрупаха на чешмата. Загълчаха, засмяха се. Между големите кълпаци и сивия би, мяркаха се белите ръкави и синия цукман на Женда. Понякога се виждаха и плитките й, разиграни два червена.
staroplaninskilegendi_06_yovkov_0072|Баба Ана гледаше от воденицата и когато дядо Иван дойде към нея, каза му.
staroplaninskilegendi_06_yovkov_0073|И от тия ще остане някой, отде знаеш. Има един да пие час по час на чешмата, без да му е жедно. Той ще остане, ще видиш.
staroplaninskilegendi_06_yovkov_0074|И наистина, когато след малко керванът потегли, една кола, колата, която вървеше най-напред и имаше най-ядри и най-силни биволи, изведнъж се наведе на една страна, колелото изхвъркна, остъза ора в земята и се счупи.
staroplaninskilegendi_06_yovkov_0075|Насъбраха се кирвънджиите, започесваха се под кълпаците, загълчаха. После тръгнаха.
staroplaninskilegendi_06_yovkov_0076|Остана само с чупената кола. Керванджията извади брадва и започна да дяла. Дялаше, но отвъртя не бързаше и все се поподсмиваше.
staroplaninskilegendi_06_yovkov_0077|На другия ден той пак дялаше, а до него стоеше Женда. Баба Анна погледна към гората. Не се чуваха звънци. Марин не се виждаше. Дълго време тя гледа тукъм колата, тукъм габара. Слънцето припече, стопли се и тя задряма.
staroplaninskilegendi_06_yovkov_0078|Затропаха чехли наблизо и тя се събуди. Пред нея стоеше Женда. Баба Анна не можа да я познае. Набелисала се и си начервила, изписала вежди като кадъна. Перо с златен варак трептеше на главата ѝ, на гушата ѝ имаше гердан от Ален Мерджан, на ръцете ѝ дрънчаха гривни. Очите ѝ светеха. Смееше се.
staroplaninskilegendi_06_yovkov_0079|— Какво се си направило, Марилу Детино? — всъпне и се баба Анна, но я гледаше захластната и се чудеше, че не може вече да я мрази.
staroplaninskilegendi_06_yovkov_0080|Много хубост ти е дал Господ, помисли си тя, да ноя само на добро.
staroplaninskilegendi_06_yovkov_0081|Женда сложи ръка на мерджановия гиртен. Бабо Ано, хубав ли е? Нали е хубав? Кервънджията ми гутаде.
staroplaninskilegendi_06_yovkov_0082|Ами Белилото? И него, всичко! Ах, Бабо Ано, да видиш само колко работи има! Колата му вътре като къща! Като отвори един съндък, че какво няма вътре! И огледало има, Бабо Ано, всичко има! Много добър челяк! И в цари град ходил, морето виждал. Хайде дома, къчи се в колата да те заведе и тебе, ще видиш морето! Бабо Ано, да ида ли? Кажи да ида ли? Иди, иди, ако коковица ти е изпила ума! Как е Варбан?
staroplaninskilegendi_06_yovkov_0083|Жен да свира мене и нищо не каза.
staroplaninskilegendi_06_yovkov_0084|Слушай, Булка, рече баба Ана строго, остави хорските мъжа и си гледай своя. Срамота е и грехота. Какъв е тост цари град, какво е то и море? Мъжа си да гледаш, че знаеш ли се. Е, че какво да му правя? Не съм Господ душа да му дам. И жен да се спусна надолу, златният враг заблещя на перото й, гривните й задрънчаха. Баба Ана я видя как отиде право при кирванджията. Той все още дялаше. А както правеше и други път, пръчът беше.
staroplaninskilegendi_06_yovkov_0085|Вечерта по тъмно жен да пак дойде при баба Ана. Плъка, окайва себе си, окайва върбана.
staroplaninskilegendi_06_yovkov_0086|Заричаше се, че няма да ходи никъде и само него ще гледа.
staroplaninskilegendi_06_yovkov_0087|Очите й те си останаха пълни със слънци.
staroplaninskilegendi_06_yovkov_0088|Когато си отиде, влезе право във воденицата и нито погледна керванджията. «Сполай ти, Боже!» рече баба Анна и се прекръсти.
staroplaninskilegendi_06_yovkov_0089|На другия ден женда излезе пред воденицата. Не отиде преки рванджията, но хорката ѝ беше на пояса. Отдалеч се тъмнееха очите ѝ. Отдалеч се познаваше, че се смее.
staroplaninskilegendi_06_yovkov_0090|И тръгна пак през поляните и запреде. Керванджията беше поправил колата си. След малко той подбра биволите и тръгна да ги пасе. Вървеше по същия път, от дето беше минала Женда. Сякаш го водеше нищата, която Женда беше разсукала след себе си.
staroplaninskilegendi_06_yovkov_0091|Грехота беше да се остави болен човек непригледан. Баба Ана прати дяда Ивана да види върбана. Когато той прекрачи прага, сепна се и сне лолата от устата си. Едно пале се притискаше до стената и жално квичеше. До него стоеше пръчът и с все сила го блъскаше с рогата си. Дядо Иван го пропъди и стори му се, че пропъди дявол.
staroplaninskilegendi_06_yovkov_0092|Воденичният камък лежеше на същото място, гдето беше примазал върбана.
staroplaninskilegendi_06_yovkov_0093|Дядо Иван влезе в стаята, удари го тежка миризма на труп. Жълти слаб, върбан лежеше възнак и щом видя дядо Ивана с бърчи лице от болка и глухо като изпод земята речи – «Изпади го! Изпади го навън!» Говореше за пръча. И се загледа в тавана с големи, оплашени очи.
staroplaninskilegendi_06_yovkov_0094|На Марина бяха си изгубили три кози. Не беше човек, който може да си прости своя грях и не се остави докато не ги намери. Познаваше козите си, както познаваше хората по лицата им. Виждаше, че някъде нещо се белее и подкарваше стадото си нататък.
staroplaninskilegendi_06_yovkov_0095|Като дойдеше там, разбираше, че не било козия бели камъни и обръщаше стадото си на друга страна.
staroplaninskilegendi_06_yovkov_0096|Три дни се губи тъй навътре в планината, кътери се по най-върлите урви, слизав най-дълбоките усои. Най-после намери трите бели кози, който беше изгубил. Зарадва се, засмя се, извади хурката, която правеше за женда и започна да я пъстри с златен и сребрен варак. Мислеше да отиде утре и да я занесе. Но не можа да изтрае. Елидинишки сякаш го тегляха надолу към водениците. Той скри писачето, с който дълбаяше по хурката
staroplaninskilegendi_06_yovkov_0097|Никога звънците на Мариновото стадо не бяха дрънчали тъй високо. Смеяха се, приказваха и викаха малките звънчета, големите хлопки гръмко биеха като великденски камбани. Баба Анагичо още отдалече разбра, че Марин иде. Когато стадото стигна до Габара, звънците позатихнаха и се разляха на широко. Между водениците се показа Марин.
staroplaninskilegendi_06_yovkov_0098|Той видя колата и разбра, че е щупена и после поправена, но около нея нямаше никой. Не се виждаше и Женда. Марин ходи в градината, гледава воденицата. Нямаше я. Поглеждаше често към баба Анна, но не смееше да отиде при нея. Най-после се реши и отиде. От вратата на воденицата го посрещна дядо Иван.
staroplaninskilegendi_06_yovkov_0099|Бре, Марина е, бре, човече, де си изгуби? Да не си се борил пак с мечката, с травницата? Пак си била явила в липов дял.
staroplaninskilegendi_06_yovkov_0100|Баба Анна гледаше Марина и очите й хитро святкаха.
staroplaninskilegendi_06_yovkov_0101|Мечката не е в липов дял, каза тя. Мечката е тука, при водениците. Не е страшна, не хапе. Има такви седни дълги коси и черни очи. Пие на чешмата и когато е жедна и когато не е, а очите играят туна сам, туна татък.
staroplaninskilegendi_06_yovkov_0102|И баба Анна искаше да срещне очите на Марина, но той гледаше навъзин в земята. Хъм, мечка! Каква ще дает аз мечка? Рече той. Уш не знаеш, а малко ли си пил и ти вода след нея. Пил си и без да ти е било жедно. И само да си ти, ай го керванджията, пи и той, и тука си остана.
staroplaninskilegendi_06_yovkov_0103|Изведнъж Барин се изправи, стана страшен и попита. Де е Женда?
staroplaninskilegendi_06_yovkov_0104|Че знам ли, Марине?
staroplaninskilegendi_06_yovkov_0105|Кротко заговори баба Ана. Знам ли, сине. Видеха, че излезе с хурка, подбра и керванджията биволите си. Не знам, сине, не знам.
staroplaninskilegendi_06_yovkov_0106|Марин нея дочака да свърши и тръгна нагоре към стадото си. Когато се закрив габъра, погледна към водениците, погледна наоколо. Женда я нямаше. Тогава той извадих урката, която беше скрил под кожуха си, начупия и я захвърли. Не чуваше вече звънците на стадото си, не го свърташе в гората. Неколко пъти той се връща и кръстосва около водениците. И сякаш растеше и ставаше по-голям и по-страшен. Веднъж мина близо до баба Ана.
staroplaninskilegendi_06_yovkov_0107|На другия ден той пак дойде. Беше страшна жега. Женда пак я нямаше. Марин не се грижаше вече за стадото си, а преваляше през баири, през долове. Понякога се спираше и тръсеше с очи. Камъните около него лъхаха топлина, сякаш се топяха от горещината. Слънцето печеше право над главата му и сянка не оставаше зад него. Мисли нямаше в ума му. Смътно разбираше какво беше станало с Женда. Смътно разбираше какво става с него.
staroplaninskilegendi_06_yovkov_0108|Дохождаше му на ум за кожичките, които й беше дал. «Ще си ги взема», казваше той със стиснити зъби. Но веднага разбираше, че не е в той болката му. Искаше му се да се върне в планината, да се скрие от хората, да си живее там самичък, както порано.
staroplaninskilegendi_06_yovkov_0109|но знаеше, че и това няма да стане и разбираше само, че голяма, страшна беда е паднала на главата му.
staroplaninskilegendi_06_yovkov_0110|и той вървеше по напечената земя.
staroplaninskilegendi_06_yovkov_0111|След него идеха кучетата му с помътени очи и увисни ли езици. Звънзите се чуваха на няколко места в гората.
staroplaninskilegendi_06_yovkov_0112|Марин се спря, послуша, но не можа да разбере, че стадото му се беше разкъсило.
staroplaninskilegendi_06_yovkov_0113|Изведнъж полъхна вятър, вдигна се прах. Марин повдигна очи. Над планината се повдигаше облак.
staroplaninskilegendi_06_yovkov_0114|Не беше равен и тежък облак, а гъсти и черни кълба, които се навдигаха и се въртяха като пожарен дим.
staroplaninskilegendi_06_yovkov_0115|Дух на вятър, най-напред топъл, после хладен, притъмня и запръскаха капки. Вятърат размяташе вече цялата гора. Червени светкавици се гърчеха като змии. Трещеше.
staroplaninskilegendi_06_yovkov_0116|Повече понавек, отколкото с усилия на волята си Марин забърза към стадото си, прибра го на завет, сам се подслони под едни скали. И повече нищо не видя, защото всичко потъна и се изгуби в бясната виелица на дъжда.
staroplaninskilegendi_06_yovkov_0117|Марин не чуваше трескавиците, не мислеше за нищо. По едно време разбра, че стана по-тъмно и по-огнено светеха светкавиците. Мръкваше се. Той скочи и тръгна по дъжда. Беше му задушно и сне кълпака си. Капките капеха по главата му като врияла вода. Когато беше още в гората, дъждът престана. А когато се надвеси над водениците, половината небеса беше прояснила. Из всички доловите чаха мътни бари.
staroplaninskilegendi_06_yovkov_0118|Марин заслиза към водениците. Един глух и страшен вой го накара да спре. Бочеше долу реката, голяма и мътна, но каменият мост стоеше здрав и водата стигаше до него. Съвсем ниско беше слязал облакът на изток и в изчистеното небе над него си показа месецът, още червен и тъмен.
staroplaninskilegendi_06_yovkov_0119|Марин вървеше нас поред дула. Една покрита кола за скрибуца изпътя под него, той я погледна и я замина. Но като излезе през чешмата видя, че колата на гирванджията я нямаше.
staroplaninskilegendi_06_yovkov_0120|Мина му най-страшната мисъл през ума.
staroplaninskilegendi_06_yovkov_0121|Видя, че Дядо Иван слиза отгоре и държи в шепите си запалена свещ и пази да ни я угаси вятърат.
staroplaninskilegendi_06_yovkov_0122|Нека върви където ще! Викаше той като навярно отговаряше на баба Анна. Широки път! Не ми е за нея, меня, а за челяка! Челяк умира тук! Християнин умира! Трябва да му се тури една въщеница в ръката!
