staroplaninskilegendi_07_yovkov_0158|Оплашиха се жените. Продължи той по-спокойно, като се обръщаше към Индже. Тине им върши косуря фенди. Завикаха – Капасъзи са. – Каквити капасъзи, думам им аз. Не видите ли, че са избрани хора? Я конете им, си е черни коне, хубави. И само един бял – на пашата. Тъй сме запомнили ние пашите – на бели коне.
staroplaninskilegendi_07_yovkov_0159|Инджя почти не го слушаше и гледаше към баира, на където избягаха жените.
staroplaninskilegendi_07_yovkov_0160|Там е селото ни, подзестарецът. От Чокорово сме. Аз съм Дядо Гуди. Дядо Гуди от Чокорово. Ех, не сме май добре. Немотия, глад. А временцето хубаво. Рекохме да поизровим земята и да засеем нещо. Малко лук, малко боб. Залувиха ме и мене, жените. Ела думата да ни пазиш. Какво ще ги пазя аз? Ама пък сами сме? Без мъжка челят сме.
staroplaninskilegendi_07_yovkov_0161|Индже погледна стареца изпод око и едва забелязано се усмихна. – Индже ли? Ти виждал ли си Индже, старче? – Де ще го видя, синко? Онзи, който го е видял, не е оживял.
staroplaninskilegendi_07_yovkov_0162|Аз кой съм? Познаваш ли ме?
staroplaninskilegendi_07_yovkov_0163|Дещи те познавам, ефенди. Приказваш като нас. Утагите има много да приказват по нашему. Сливинският таянин Тахирага знае го. И той тъй чисто приказваше. Не те познавам.
staroplaninskilegendi_07_yovkov_0164|Той замълча и замисляно спря натъжените си очи на Индже.
staroplaninskilegendi_07_yovkov_0165|Не те познавам, ама чуй какво ще ти река. Млад си, хубав си, юнак си. Де е такъв господар да имаме като тебе? Ще ти слугуваме, ще ти плащаме харач. Но само ти да си. А то сега какво е?
staroplaninskilegendi_07_yovkov_0166|Какво е сега? Кой отде иде коли, кой отде иде граби и пали, а ние сме прости хора, ние сме като овце. Добре е да има кой да се грижи за нас, да ни стрижа и да ни дуи, ама и от вълци да ни пази.
staroplaninskilegendi_07_yovkov_0167|Индейсът е смя.
staroplaninskilegendi_07_yovkov_0168|Първата му усмивка престая пролет, извади кисията си, сграбчи шепа жълтици и каза да оставят по една на всяка му тика.
staroplaninskilegendi_07_yovkov_0169|Нека се ги вземат жените, като се върнат, каза той. И нека помнят Индже. А ти, старче, прощавай, прощавай и сполай ти за думите.
staroplaninskilegendi_07_yovkov_0170|Като змия изсъска гъстоплетеният камшик в ръката на Индже, белият му кон хвръгна под него. Трепнаха кърджалиите, почувстваха, че Индже ги води, и препуснаха конети си след него. Ония, които бяха слезли, качиха се и същота и бързо препуснаха. Земята закънтя под копитата на конете, а старецът стоеше под цъфналата слива и гледаше след тях.
staroplaninskilegendi_07_yovkov_0171|Разнесе се пак славата на Индже. Заговориха за него всички. И сега славата му беше много по-голяма, отколкото по-рано. Защото Индже не бастисваше села и казъби, не колеше, не убиваше. Индже сам гонеше сега кърджалиите, требеше хайдутите и обирниците по пътищата. Първ изпита гнева му си в Рибилюк баше.
staroplaninskilegendi_07_yovkov_0172|Имаше го Индже за приятел и прати да му кажат да престане да граби и да си върви поживо, поздраво. Сиври Билюк баше се измя и прогони хората му. Тогава Индже Врах летя отгоре му като ястреб. Кърджелиите, претоварили конете си с плячка, тежки и неповратливи като костенурки, бяха избити до един.
staroplaninskilegendi_07_yovkov_0173|Насеври Белюк башиториха запалени машали под мишниците и го изгориха жив.
staroplaninskilegendi_07_yovkov_0174|Навред по пътищата увиснаха по дърветата избесени хайдути. Всяка сутрин пред чадъра на Индже се търкаляха глави на хайдушки главатари. И не само за хайдути и за обирници беше страшен Индже. Аени, спахии и бегове, всички ония, които имаха власт и владееха земята, поотпуснаха коляното си и не притискаха тъй много райата. Къдиите по диваните, щом си спомняха за Индже, потапяха веднъж и два шпачите си пера в девитите,
staroplaninskilegendi_07_yovkov_0175|Минаха се две години. Очистени бяха всички гори и дабрави, развързани бяха всички пътища. Тогава от връх Балкана, от Жеруна, Индже взе чорбаджийска дъщеря и я прати с нови стомни, сама и пеша, да иде чак на бъкаджиците и да му донесе вода от седемте кладенци. Момичето беше младо, хубаво като капка. На шията си имаше седем реда рубета и махмудии, облечено беше в атлас и сърма.
staroplaninskilegendi_07_yovkov_0176|и ходи и върна се с вода от седемте кладенци, вървя седем дени нататък и седем дени назад.
staroplaninskilegendi_07_yovkov_0177|Никой не посмя да я закачи, не падна косъм от главата й, не се изгуби нито едно рубе от нанизите й. Хората я изпращаха до край село и я оставяха сама.
staroplaninskilegendi_07_yovkov_0178|Што м те е казал Индже? Нека! И много здраве!
staroplaninskilegendi_07_yovkov_0179|Засмяно тръгна момичето, засмяно се върна. Нямаше хайдоти по пътищата, нямаше лоши хора. Тогава Индже тръгна към бъкъджиците. Безплодна и черна беше земята, когато беше тръгнал, а сега цяла Румъния се жълтее от озрели ниви. Наспорил беше бог земята с тежък плод и хората работеха. Люлее се морето на зрелите жита, трепти въздухът, белеят се като бели птици за братките на житварките.
staroplaninskilegendi_07_yovkov_0180|Звъни песента под ясното небе, ронят се думите като зарна от тежки класове. Индже слуша.
staroplaninskilegendi_07_yovkov_0181|Нещо сладко се топи в гърдите му, от очите му се проронва сълза и пада върху бялата грива на коня му.
staroplaninskilegendi_07_yovkov_0182|Първата сълза, която Индже беше пролял през живота си.
staroplaninskilegendi_07_yovkov_0183|Навръх на бъкъджиците, при седемте кладенци е лагерът на Индже. Той е много по-голям отколкото тая пролет.
staroplaninskilegendi_07_yovkov_0184|Но няма си в Рибелюк баши, няма да али и капасъзи. Млади момци ходят по поляните, мятат камък за да опитат силите си или стоят пред чадарите и чистят дълги бойли и пушки.
staroplaninskilegendi_07_yovkov_0185|А настрана, под сянката на кръстати буки, седят белобради войводи. Тук са Никола Озуна, Добри войвода, Вълко Бинбеля, Вълчан войвода и много други. Лицата им носят белези на стари рани, косите им са бели, мъдрата им реч тече равно и тихо, както тече водата на кладеница пред тях.
staroplaninskilegendi_07_yovkov_0186|Тепе деле налипа шаца ру в Янина, говори добри войвода и пуши с дълги си чибук. Във видин е пазванто угло, а Мустафа бай Рактар в тръстеник. Всеки е завардил своя мера, реди и съди своите хора. Защо и ние да не заемем нашето? Кой ще ни спре? Кой ще ни каже не бива?
staroplaninskilegendi_07_yovkov_0187|Той замлъква за малко, вижда, че още никой не е бързът да му отговори и подема.
staroplaninskilegendi_07_yovkov_0188|Знам какво мисли Индже. И нека го кажа. Добро е. Първо и първо той гледа да се откачи от тия кучета, от Карафейза и от Емина. Веднъж да се раздели от тях.
staroplaninskilegendi_07_yovkov_0189|Ама как, това ми кажи ти мене! Прекъсва го Никола Озуна и понавик, без да има нужда, хваща се за ножа си.
staroplaninskilegendi_07_yovkov_0190|Небързай, ще ти кажа. Индже е поръчал на Караколя да хване двамата есерлийски султани, ония младите, двамата братя, и да се разправи с тях по шейтан Пенчовия осул.
staroplaninskilegendi_07_yovkov_0191|Султанчетата са роднина на Карафеиза и, щом той чуе, че се убити, ще се усъмни в юмер драза и ще се хванат за гуша двамата кърджали като псета.
staroplaninskilegendi_07_yovkov_0192|Разбирам сега! – казва Озуна, бутва назад калпака си и гърлисто се смее. Разбирам! Т'у е добро! Ей, добро е! Вълчан Войвода свива вежди, махва на Озуна да мълчи и пита добря. А сетне? Сетне ще се събират тук, на Бакъджиците. Юнаци от всякъде! Ще расте силата ни! А като чуем, че московецът пригази у Дунава, ще речем и ние – ела, Боже, помози!
staroplaninskilegendi_07_yovkov_0193|Прихваждат с ръка белите си бради войводите, замислят се и гледат как бистрата кладенчува вода бяга и лъщи, като че носи някаква тайна. Вятър минава по върха на старите буки и листата им зашумяват.
staroplaninskilegendi_07_yovkov_0194|А Индже се разхожда пред чадъра си, ходи по самия гребен на Бакаджика, гдето вятърат развява високата трева.
staroplaninskilegendi_07_yovkov_0195|Небето потъмнява, блясва като елмаз голяма звезда на юг.
staroplaninskilegendi_07_yovkov_0196|Индже ходи и мисли.
staroplaninskilegendi_07_yovkov_0197|Спира се и поглежда назад към Румъния. Спомня си за песента на жътварките, за разплаканите от радост хора, които го посрещаха като цар. Спомня си това и лицето му прояснява.
staroplaninskilegendi_07_yovkov_0198|Но той поглежда на изток, към отвъдната страна на бъкаджиците и мъка свива пак сърцето му. Там още стоят следите на неговите походи. Там майките още кълнат инже.
staroplaninskilegendi_07_yovkov_0199|Той си спомня за Пауна и за детето си и си мисли, най-тежкият ми грях е там. Трябва да ида и на тая страна.
staroplaninskilegendi_07_yovkov_0200|Когато Индже се повърна към чадъра си, мина покрай старите буки, под които още стояха войводите. Не се виждат лицата им, светят само като светулки запалените им чибуци.
staroplaninskilegendi_07_yovkov_0201|И чува Индже как Никола озона се провиква. Еххххххххххххххххххххххххххххххххххххххххххххххххххххххххххххххххххххххххххххххххххххххххххххххххххххххххххххххххххххххххххххххххххххххххххххххххххххххххххххххххххххххххххххххххххххххххххххххххххххххххххххххх
staroplaninskilegendi_07_yovkov_0202|Чу това Индже, кимна с глава, като че се съгласяваше и пак си помисли. Тряба, тряба да ида отвъд.
staroplaninskilegendi_07_yovkov_0203|Яхнал белия си кон, който гордо пристъпва с разпусната грива, Индже слиза с дружината си към другата страна на бъкъджиците – към морето. Голям празник е, света троица, и на днешния ден у Румени кой има сбор. Индже е весел и чист, е всяка помисъл у него, защото знае где отива. След него, на според един до други, ездят на хубави коне белобрадите войводи, а след тях е дружината на Индже с байрак Таря Каракол.
staroplaninskilegendi_07_yovkov_0204|Когато наближиха селото, посрещнаха ги звънки удари на камбана. Негръмна пушка, не се чуо плашен вик, както други път, ората не се разбягаха.
staroplaninskilegendi_07_yovkov_0205|Индже се усмихваше, лицето му светеше, никога той не е изглеждал тъй хубав ионашки напет.
staroplaninskilegendi_07_yovkov_0206|Гледат го старите войводи, прекарват ръка по белите си бради и сърцата им се топят от радост и гордост.
staroplaninskilegendi_07_yovkov_0207|Пората от Уру-Мени-Кьой наистина не мислиха да бягат. Някои казаха, че вълкат козината си, мени но зъбите не, и искаха да обърнат пушките си срещу Индже или да бягат. Но скочеха други, които бяха ходили по Загора и по Румъния и казаха, че Индже трябва да се посрещне с иконата на света Тройца с хляб и сол.
staroplaninskilegendi_07_yovkov_0208|Така и решиха всички, които бяха събрани в черква.
staroplaninskilegendi_07_yovkov_0209|И посегнаха някои, взеха черковните хоругви, попът с разтреперани ръце по екраста и иконата, ишествието, многобройно и пъстро, бавно и тържествено, в богомолна тишина се източи из черковния двор и тръгна към оная страна, от дето идеше Индже.
staroplaninskilegendi_07_yovkov_0210|Дочерквата бяха се спрели два мудуши – мъж и жена – възседнали на катъри.
staroplaninskilegendi_07_yovkov_0211|Жената носеше къса салтамарка с лисича кожа и тънка зелена махрама на главата си. Тя не беше в първата си младост, но беше хубава. Чертите на лицето й бяха едро и твърдо очертани, в цялата й външност имаше достоинство на царица. Мъжът беше стар хайдутин, побелял, но здрав, червен, с големи рунтави вежди и мустаци като кадели. Носеше дрехи от червено сукно с потъмняла сърма, отзаде му висяха джепкени, а коженият селях напоява.
staroplaninskilegendi_07_yovkov_0212|Мъжет и жената гледаха народа, който излизаше от черква. Всички, които минаха покрай тях им казаха, че отиват да посрещнат Индже.
staroplaninskilegendi_07_yovkov_0213|Мъжът и жената се спогледаха и очите им овлъжняха. Те слязоха от катарите, поведоха ги на ръка и тръгнаха с множеството. Мъжът чумреше рунтавите си вежди и възбудено шепнеше. Ще му кажа, аз съм Сяробър от Чията, не ме ли познаваш? Ето, дойдох сам, доведох и Пауна. Когато ти колеше и убиваше, аз гръмнах в тебе, исках да те убия. Сега ти крило си за нас, наш татко си.
staroplaninskilegendi_07_yovkov_0214|А Индже вече влизаше в селото. Не искаше да бърза и гледаше да удържи крачките на коня си, който кой знае защо беше станал нетърпелив и буен.
staroplaninskilegendi_07_yovkov_0215|Изведнъж едно малко човече прикуси сукака и мина път на Индже. Беше Гърбавото. То се спря и се загледа.
staroplaninskilegendi_07_yovkov_0216|Изглеждаше, че се чуди на Индже, на коня му, на светналите му от сърма дрехи, на пауновото перо, което трепереше на кълпака му.
staroplaninskilegendi_07_yovkov_0217|Индже би го отминал, ако не беше забелязал, че това гърбаво и уродливо момче държи под мишницата си къса пушка.
staroplaninskilegendi_07_yovkov_0218|Мисли за добро имаше Фумъна Индже и не хора с пушки искаше да вижда днес, пък и весел беше и искаше да си пуше губа.
staroplaninskilegendi_07_yovkov_0219|Я слушай! Извикът ой на гърба вуту. Дай пушката тука!
staroplaninskilegendi_07_yovkov_0220|Гърбавото се начумери, измърмора нещо и избяга. Той е пътин, Дже видя отблизо очите му и тия очи събудиха у него нещо, което той не можа да разбере какво е. Но по отпуск на коня й тръгна подир него. — Дай пушката! — викаше той и се смееше.
staroplaninskilegendi_07_yovkov_0221|Гърбавото влезе в един двор. Индже подир него.
staroplaninskilegendi_07_yovkov_0222|Спрени на улицата, войводите го чакаха и се усмехваха, защото виждаха, че се шегува.
staroplaninskilegendi_07_yovkov_0223|Индже обърна коня си да се върне. Същия миг гърбавото вдигна пушката, прицели си и гръмна. Подскочи белия кон, Индже се изкриви на седлото и падна.
staroplaninskilegendi_07_yovkov_0224|Спуснаха се всички, които бяха наблизо, скочиха от конете и прихванаха Индже. Други погнаха гърбавото. Най-напред пренесоха Индже до пруста на къщата в двора, на която беше паднал. Разкопчаха го, търсеха раната. Бързаха да я привържат. А вън се повдигна страшен шум. Мятаха се черни коне, лъщяха я тегани, страшни гласове, пълни с отчаяние и болка, викаха – «Убиха войводата! Убиха Индже!»
staroplaninskilegendi_07_yovkov_0225|Спуснаха се конници от една и от друга страна, за да пресекат пътя на Гърбавото и да го хванат.
staroplaninskilegendi_07_yovkov_0226|Множеството, което се зададе от Камчерквата, повърна назад и се разбяга. Писнаха жени, селото се изпълни с викове и плач.
staroplaninskilegendi_07_yovkov_0227|До това време баба Яна кълмучката стоеше прилепена до стената на къщата си, гдето беше се случила. И въпреки страшната бъркотия наоколо, запазваше това спокойствие, което идеше преди всичко от възрастта и глухотата й.
staroplaninskilegendi_07_yovkov_0228|Но когато и тя чуда викат от всички страни – «Индже! Убиха Индже!» – трепна и се втурна към пруста. И тя се появи там разтреперана и суха, очите й горяха и търсеха неспокойно. Войводите, които се лутаха около Индже, я помислиха заобъркана от страх и я избутаха навън.
staroplaninskilegendi_07_yovkov_0229|Но тя можа да види Индже. Той лежаше на пруста, опрян до стената. Беше гологлав. Калпакът му с пълновото перо беше паднал до него. Нямаше болка на мургавото му лице, но дишаше тежко и смъка. Под него беше протекла локва кръв.
staroplaninskilegendi_07_yovkov_0230|В двора нахлуха много хора. Водеха гърбавото. Два му от войводите, Добри и Вълчан, бяха извили назад ръцете му и здраво го държаха. — Той е ли го уби, той е ли? — викнаха наоколо кърджелите и размахваха я таганите си. — Чакайте, при Индже да го заведем. Той да каже.
staroplaninskilegendi_07_yovkov_0231|И ония, които бяха при Индже, излязоха вън. Тогава баба Яна се приближи до него.
staroplaninskilegendi_07_yovkov_0232|5. Тели си инже
staroplaninskilegendi_07_yovkov_0233|кое туй мумче речинже.
