zhetvariat_12_yovkov_0055|Двете машини преминаха през село и влязоха в двора на Вълчана. Тук те щяха да останат, докато дойдеше време за вършитба.
zhetvariat_12_yovkov_0056|Разпрегнаха воловете, извадиха нови зелени брезенти и грежливо покриха с тях локомобила и бътозата.
zhetvariat_12_yovkov_0057|Вълчан с по-старите селини влезе в къщи, а Жела за смяна и зарадване, както прилича на всяка ступанка, тръгна из двора да почерпи сракия у ния от мъжете, които бяха работили около машините.
zhetvariat_12_yovkov_0058|След нея вървеше Мита, за да й помага. И гдето бяха те, там се вдигаше глъчка и смях.
zhetvariat_12_yovkov_0059|Никой не искаше да си ходи. И хорото на место да стане като други път, намегданя при черквата, извисе и се залюля тука.
zhetvariat_12_yovkov_0060|Събрало се беше цяло село. Толкова хора и такова хоро не е имало в къщата на Вълчана дори и тогава, когато той е подигал тежки сватби за да жени синове и дъщери.
zhetvariat_12_yovkov_0061|Край на глава 12-та
zhetvariat_12_yovkov_0062|Този запис е обществено достоянни.
zhetvariat_13_yovkov_0000|ЖЕ ТВАРЯТ ГЛАВА 13
zhetvariat_13_yovkov_0001|Записано за LibriVox.org
zhetvariat_13_yovkov_0002|ЖЕТВАРЕТ ПОВЕСТОТ УРДАНИЯ ОВКОВ Глава 13
zhetvariat_13_yovkov_0003|Мълчелив свидетел на това тържество беше и поп Стефан. Изправен на Мегданя до черквата, сложил ръце на патерицата си, той беше наблюдавал отдалеч всичко. Старият свещеник искрено се радваше като виждаше, че враждите и раздорите в селото поотихват и между хората се заражда повечко любов и сговор. Дружеството, мислеше си той, свърши добра и полезна работа. Сдружи селените. Помири ги.
zhetvariat_13_yovkov_0004|Тази вършачка също ще помогне много на селото. Поп Дочо и Вълчан заслужават всяка похвала, за където те изалягат и си грижат за общите работи.
zhetvariat_13_yovkov_0005|Наистина Вълчан зле се е смразил с добривия син. Не е и прав, но никой не може да отрече, че в много други случаи той показва милозливо сърце, помага и услужва с каквото може. А Бог държи точна сметка не само за лошото, но и за доброто. Той е, който ще ни съди. Заключив ума си Поп Стефан, погледна още веднъж към веселата навалица в двора на Вълчана и тръгна да си ходи.
zhetvariat_13_yovkov_0006|Изведнъж му дойде на ум за иконата, която Вълчан искаше да подари на черквата.
zhetvariat_13_yovkov_0007|Сега, когато хората поимаха добрия път на сговора и на труда, нямаше да бъде зле да обърнат очите си към Бога. Ето най-изгодното време да се направи някое подеяние, да се разгласи посочи за пример.
zhetvariat_13_yovkov_0008|Вълчан беше готов да створи това. Иконата от Коле вече беше поръчена. Но дали е готова? Дали дядо Нетко беше работил поне нещо?
zhetvariat_13_yovkov_0009|Поп Стефан не знаеше.
zhetvariat_13_yovkov_0010|Поп Стефан мина покрай него без да му продума, без да го погледне дори. Надя до нетко го забеляза. Опря пръсна челото си. Помисли и види се след като мъчително и бавно промянещо обхвана го изведнъж страшна ярост.
zhetvariat_13_yovkov_0011|Черно капец! Завика той подирпоб Стефана, като се кандилкаше на сам нататък. Фарисей! Пьян съм, на! Пьян съм! Какво ще ми направиш? Пия и ще пия!
zhetvariat_13_yovkov_0012|Друг път Поп Стефан мина покрай кръчмата. Вътре беше дядо Нетко, пиян пак както всякога.
zhetvariat_13_yovkov_0013|«И справил се над главата ми,» високо разказваше той, «сякаш душата ми иска да вземе. Работи-та работи. Абе, човече Божи, хич сега време за икони ли е? Пората не вярват в истинските светци, камо ли в писаните. Нищо не вярват, ни в Бога, ни в дявола вярват. Икона? Какво е иконата? Бойди се на инашара на дъска! Целуваше и се кланяш. Идолопоклонство е тоя, не християнство.
zhetvariat_13_yovkov_0014|Поп Стефан разбра, че иконописъцът е непоправим. Наскоро сам той се разболя и днес за първи път излизаше от къщи. През това време той нищо не беше чул за дяда Нетка. Тук ли е още или пък си е заминал за града? Да не би пък да е болен. За омраза и отмъщение нямаше място в сърцето на Поп Стефана. Той си укори, че беше забравил досега бездомний иконописец. Не беше попитал, где е и как прекарва. И на место да иде от дома си, той се повърне и влезе в черковния двор.
zhetvariat_13_yovkov_0015|Отедалеч още той видя, че вратата на килера беше отворена, имаше изоти обуще и еднато яга беше подпряна до стената.
zhetvariat_13_yovkov_0016|Иконописицата беше тук. Поп Стефан надникна през прозореца, но не може да види нищо, заобиколи и мина към вратата. Повика, покашли се. Никой не се обади. Тогава той прекрачи прага и влезе.
zhetvariat_13_yovkov_0017|но не успя и две крачки да направи и той се сепна, спря се и остана като прекован на мястото си.
zhetvariat_13_yovkov_0018|Насреща му, изправена до стената стоеше голяма и съвсем нова икона.
zhetvariat_13_yovkov_0019|Господи, каква икона беше тя?
zhetvariat_13_yovkov_0020|Всякаш не материален образ беше жив дух, тайнствено някакво видение.
zhetvariat_13_yovkov_0021|Иконата беше на Иисуса Христа. Тя беше голяма, една от ония икони, които се поставят от ляво или от дясно на царските двери.
zhetvariat_13_yovkov_0022|Такава икона Поп Стефан виждаше за пръв път.
zhetvariat_13_yovkov_0023|Те както беше изписана, те беше пълно отклонени от всички правила и образци на черковната живопис.
zhetvariat_13_yovkov_0024|Исус не седеше на трон в това царствено величие, както ще седи в дени на славата Си. Не беше и Тъй, както го представят други, обкръжен от облаци или пък сред тежкия и безжизнен пейзаж на юдейската пустиня.
zhetvariat_13_yovkov_0025|Иконата, която гледаше Поп Стефан, се виждаше съвсем друго. Два главни тона преобладаваха тука. Две големи петна преди всичко. Едно синьо и едно жълто. Виждаше се най-напред високо и пространно небе, което се снишаваше в мътна, белизникава и прашна омара на горещ летен ден.
zhetvariat_13_yovkov_0026|И после една безкрайна жълта равнина под това небе. Равнина от озрели, готови за жетва ниви. Из тия ниви вървеше Исус.
zhetvariat_13_yovkov_0027|Около него се растила и го окръжава златно море. Губи се и се топи в мъглявите даличини на хоризонта.
zhetvariat_13_yovkov_0028|Но самата фигура на Исуса е голяма и близо. Ясно се виждат преплетените стъбла и класове, които закриват до някъде нозете му. Из жетата блещят алини макове и синя метличина.
zhetvariat_13_yovkov_0029|Исус остава все пак високо над повърхността на нивите.
zhetvariat_13_yovkov_0030|Дрехите му имат типичните си бои, червено и синьо. Фигурата се познава, лицето е същото. Но няма и капка следа от това невъзмотимо спокойствие, недостъпно и дори строго. Няма и тая префинена красота, както е в общоприятите икони. Дрехите са без блясък, без драпировка, потъмнели и прашни. Лицето е слабо, загоряло от слънцето, загрижено и скръбно. Очите гледат замислено и кротко.
zhetvariat_13_yovkov_0031|Исус благославяше обилния плод на земята, благославяше и края на тежкият човешки труд.
zhetvariat_13_yovkov_0032|Поп Стефан не можеше да откъса очите си от тая икона. Забрави где се намира, за какво беше дошъл. Най-после той се съвзе и потърси с очи иконописеца.
zhetvariat_13_yovkov_0033|Стаята като че нямаше никой. Невъобразим хаос царуваше навред.
zhetvariat_13_yovkov_0034|Дъстчиният плод беше изкален и нечист. Шурупки от яйца, гипсов прах, парчета от сумпара, РНД и триски се валяха на всяка стъпка.
zhetvariat_13_yovkov_0035|Върху една мрямурна плоча бяха разтрити разноцветни буи, лъщяха и листа от златен варак.
zhetvariat_13_yovkov_0036|Четки от различна големина бяха натопени в очукан и смачкан съд.
zhetvariat_13_yovkov_0037|Все пак от всичко най-много бяха боите насипани в най-чудновати съдове – кафени филджани, мидини черубки, тъникийни кутии, черепи от стомни и паници.
zhetvariat_13_yovkov_0038|Всичко това беше разпръснато в най-голямо безредие из таята. Един тучен хаван беше сложен на стола и до него няколко сухи кори хляб. Миришаше на лак, безир и разни други масла.
zhetvariat_13_yovkov_0039|Това беше неприветното жилище на беден човек и в същото време работилница в която се криеше непонятно и тънко изкуство. Сред безкрайната бъркотия на стаята иконата изглеждаше още по-хубава, по-светла и по-нова. Родена сякаш из околния хаос също тъй, както слънцето се ражда из мрачините на нощта.
zhetvariat_13_yovkov_0040|Но къде беше семейтик-онописец?
zhetvariat_13_yovkov_0041|Поп Стефан го търсеше с очи и най-после можеа да го намери. С вид долеглото си, дядо Нетко стоеше гърбом към вратата.
zhetvariat_13_yovkov_0042|Сянката, която се събираше в той ъгъл и закачените отгоре дрехи още повече го закриваха. Подпрял глава с двете си ръце, той унесено и неподвижно гледаше в иконата си. Не усещаше и не подозираше дори, че при него е влязал чужд човек.
zhetvariat_13_yovkov_0043|– Нетко! – извика високо Поп Стефан. Сивата купчина от дрипи се раздвижи. Показа се едно лице, сухо, пръстено и жълто и към стария свещеник се устремиха две очи, запалени и светли като въглени, блождаещи и занесени като някой сумнъм бул.
zhetvariat_13_yovkov_0044|Тие очи гледаха, но сякаш не виждаха и не познаваха.
zhetvariat_13_yovkov_0045|— Нетко, повтори поп Стефан за чуден. Тук ли си?
zhetvariat_13_yovkov_0046|Ела от чела.
zhetvariat_13_yovkov_0047|глухо и като че изпод земята се обади иконописецът.
zhetvariat_13_yovkov_0048|Той се възви и без да промени в нещо позата си загледа се пак в иконата.
zhetvariat_13_yovkov_0049|Поб Стефан тръгна към него.
zhetvariat_13_yovkov_0050|Штом, чо стъпките му облизо до себе си, я донетко отпусна ръцете си, не без мъка, откъсно, че от иконата изстана. Почтително, но мълчеливо и без усмивка той поздрави Поб Стефана и му целу на ръка.
zhetvariat_13_yovkov_0051|След това отново се загледа в иконата.
zhetvariat_13_yovkov_0052|— Та ти си свършил вече! — заговори радостно Поп Стефан. — Ааааааааааааааааааааааааааааааааааааааааааааааааааааааааааааааааааааааааааааааааааааааааааааааааааааааааааааааааааааааааааааааааааааааааааааааааааааааааааааааааааааааааааааааааааааааааааааааааааа
zhetvariat_13_yovkov_0053|Дядо Нетко всякаш не чуваше и не разбираше какво му се говори. Той мълчаше, всета й онесени вглебе на себе си. Голяма промяна беше станала у него. Отслабнал беше още повече. Набръчка на кожа висеше отдолу под братника му, коя цял потреперваше като от треска.
zhetvariat_13_yovkov_0054|Страдание и скръп имаше на лицето му. Поп Стефан го изгледа загрижено и неспокойно.
zhetvariat_13_yovkov_0055|– Не т'ко, каза той, и ми изглеждаш май добре, да не си болен.
zhetvariat_13_yovkov_0056|Не, отче, нищо не ми е. Здрав съм, слава Богу. Здрав съм, ама и твърде добре не съм.
zhetvariat_13_yovkov_0057|Пъп Стефан беше си загледал пак в иконата и не го дочу.
zhetvariat_13_yovkov_0058|Хубава е, много е хубава! Повтаряше той.
zhetvariat_13_yovkov_0059|След това той се замисли, помълча доста време и добави, «Хубава е, ама защо си я направил тъй? Не е като старата, не е като други, както съм ги виждал. Там Исус е седнал, държи евангелие или е прав, но друго е. А тук и тия ниви, защо тъй си я изписал нетко?»
zhetvariat_13_yovkov_0060|Иконописицата обърна към него занесения си и блождаещ поглед.
zhetvariat_13_yovkov_0061|— Тъй го видях, отче! каза той.
zhetvariat_13_yovkov_0062|Те и го видяли?
zhetvariat_13_yovkov_0063|Кого?
zhetvariat_13_yovkov_0064|Не е го отче. Видях го тъй както е на иконата. Както го гледаш ти сега. Тъй го видях.
zhetvariat_13_yovkov_0065|Без да продума нещо, Поп Стефан недовречиво погледна иконописица. Може наистина да е болен и да не знае какво говори.
zhetvariat_13_yovkov_0066|Дядо Нетко разбра учудването му е тихо, с едно особено вълнение в гласа си повтори.
zhetvariat_13_yovkov_0067|Видях го отче. Видях го те казвам.
zhetvariat_13_yovkov_0068|Поп Стефан не знаеше какво да каже.
zhetvariat_13_yovkov_0069|Седни, седни, поткани го дядо Нетко. Не ме гледай тъй. Нито съм луд, нито съм пиян. Седни. Ще ти разкажа всичко.
zhetvariat_13_yovkov_0070|Той седна на леглото си, поп Стефан на стола.
zhetvariat_13_yovkov_0071|и двамата гледаха иконата.
zhetvariat_13_yovkov_0072|Слънцето засядаше и меки златисти лъчи пълниха стаята.
zhetvariat_13_yovkov_0073|Още по-живо и по-ясно сега изпъкваше образът на Исуса, излизаше сякаш из рамките на дъската, възставаше пред тях като безплатно и светло видение.
zhetvariat_13_yovkov_0074|Загледан в него дядо нетко заговори тихо, почти шепнеш ката.
zhetvariat_13_yovkov_0075|Като често се спираше било отвълнение, било да си почине.
zhetvariat_13_yovkov_0076|Той почна от самото начало.
zhetvariat_13_yovkov_0077|Разболях се от мъка вече отче, разказваше той. Идеше ми да умра. Една вечер лежах я и тука. Болен бях, цял в огън и треска. Сън не ми идеше. Обръщах се ту на една, ту на друга страна. Като че бях легнал на тръни и на куприва. И какво ни премислих?
zhetvariat_13_yovkov_0078|Мъчно ми беше, отче, мъчно ми беше за себе си. Без дом, без свой, ейта и сами че ки отритнат. Никой не те приглежда, никой добра дума ни ти казва. Все хули, все една отрова само.
zhetvariat_13_yovkov_0079|Лоши, лоши сме отчени и хората.
zhetvariat_13_yovkov_0080|Той спря, въздъхне и си почина малко.
zhetvariat_13_yovkov_0081|Срамотно и грешно живях аз, отче, продължи той. Не крия. Грешно. Ама и теглих. Много теглих.
zhetvariat_13_yovkov_0082|Прекарах всичко през ума си нея нощ. Тегло. Само тегло. И ако имаше нещо хубаво да съм видял и аз, то е било пак тук, село. Нали помниш? Ходехме по нивите, когато бяхме малки. Работехме. Дойдеше ли жетва, там лягахме. Там ставахме. Хубаво беше тогаз. Мислих си за той, мислих си за старите, бог да ги прости. И плаках.
zhetvariat_13_yovkov_0083|Гласът на дядо Нетко трепна. Поп Стефан слушаше за мислен и загледан в иконата.
zhetvariat_13_yovkov_0084|Деленето го продължи.
zhetvariat_13_yovkov_0085|Колко време си е минало, тъй не зная, не зная и какво ставаше с мене, буден ли бях или бях задремал. Изведнъж някаква светлина изпълни цялата стая, бледа и мътна като бяла мъгла.
zhetvariat_13_yovkov_0086|Нищо не виждах в нея от първен, но ето след та светлина се появи той. И досушно тъй както го виждаш сега. И нивите бяхат тъй около него.
zhetvariat_13_yovkov_0087|И кротък и благ беше и тъй милостив, тъй милостив.
zhetvariat_13_yovkov_0088|Утешителю из векъх Господи Исусе Христе!
zhetvariat_13_yovkov_0089|Огасна светлината и той се изгуби.
zhetvariat_13_yovkov_0090|Станах, разведеляваше се, сложих дъската и почнах да работя. Всичко вървеше спорно и леко, ръката ми повтаряше туй, щото очите ми бяха видели.
zhetvariat_13_yovkov_0091|Дядо не е токо млъкна. Дишаше тежко. Очите му горяха.
zhetvariat_13_yovkov_0092|И вече не го видях, попита Поп Стефан. Не, не го видях вече. Божа работа, Божа работа. Вярваш ли ми отче? Вярвам ти. Как да не ти вярвам? Много си отслабнал. Трябва да си починеш вече. Едно нещо ще ти попитам отче. Какво? Попита Поп Стефан.
zhetvariat_13_yovkov_0093|Виждаш как съм направил иконата. Той върви между нивите. Не тъй го пишат нашите майстори, не тъй и ферминията.
zhetvariat_13_yovkov_0094|Не е ли противното и написанието?
zhetvariat_13_yovkov_0095|Нали те сега видял? Хазапап Стефан
zhetvariat_13_yovkov_0096|Той го видях отче. Той сам те е научил тогаз как да постъпиш. Какво противно и забранено може да има тук?
zhetvariat_13_yovkov_0097|Все пак изглеждаше, че тази мисъл за първи път идваше в ума на Поп Стефана и го затрудняваше. Той помълча малко. Изведнъж като че най-после добре беше си припомнял нещо, каза.
zhetvariat_13_yovkov_0098|Не, нищо противно не може да има тук на вярата. Той сам често е говорил за той. Не обичаше ли да уподобява в притчите си човешкия живот на Нива, добрите хора на житни класове, лошите на плебели? Не наричаше ли последния час жетва и ангелите жетвари?
zhetvariat_13_yovkov_0099|Той говореше за туй, що беше около него, щото виждаше. Апак и унес, що го слушаха, бяха прости и бедни хора, рибари, овчари и земледелци като нас.
