zhetvariat_07_yovkov_0007|Мина се два-три часа и повече, беше вече късно през нощта, а Гроздан, Тачката и Дядо Нетко още стояха в стаичката и не губиха надежда, че търговците пак може да се върнат. И тримата бяха пияни, особено Дядо Нетко. Масата пред тях беше отрупана с чинии и чаши, с оглозгани кости и трухи.
zhetvariat_07_yovkov_0008|Под мъжделивата светлина на лампата се усмихваха трите хубавици от картината на дядо Нетко. Останалата част беше в сянка и не се виждаше.
zhetvariat_07_yovkov_0009|Някой за тропа вън пред вратата оттърсваше се от снега. Гроздан, тачката идя до нетко и тримата с чаши в ръка се спогледаха. Майче идат, прошепна тачката.
zhetvariat_07_yovkov_0010|Вратата се отвори и влезе монката. Тачката се намръщи. Уф, монка, ти ли си? Аз пък рекох, че са вълнарите. Кои вълнари? Търговците. Какви търговци? Ех и ти, ти нищо не знаеш.
zhetvariat_07_yovkov_0011|Груздан напълни една чаша и я подаде на Монката. — Пий, Монка, едно вино. Къде си бил? — На долната кръчма. Там чорбаджата се събрали. И Вълчан беше там. — Е, какво казва Вълчан? — попита Груздан, всете изпокоени усмихнат. — Какво ще каже? Все с тебе се еде, не го ли знаеш?
zhetvariat_07_yovkov_0012|Онката изпи виното, поутърси потурите си от снега и продължи. Много сняка, ей! И пътеки няма, трябва да газиш направо. Хм, Вълчан. Слушах го, слушах, пък рекох. Бе бай, Вълчан, рекох. Защо не се помирите с Груздана? Оставете, рекох, тая мараза. А той? Като кипна, като скочи. Аз, твоя приятел ли кай? Аз кай ще го накарам да гледа, ей, тъй е!
zhetvariat_07_yovkov_0013|Мунгата разпере пръсти пред ушите си, което значеше, че Вълчан ще тури грозда на в затвора и ще го накара да гледа тъй през желязната решетка на прозорците.
zhetvariat_07_yovkov_0014|Друго какво каза? Се той! Аз кай ще го науча него, ще го прати да чука камъни на пътя. Брей! Каза Груздани си усмихна.
zhetvariat_07_yovkov_0015|Монката го гледаше очуден. Груздан беше спокоен. На хубавото му лице нямаше ни една бръчка на гняв. Само перчанът му, паднал въз челото, беше много разбъркан и очите му горяха, но то ще дай е от виното. Сребърната му обеца на едното му охола, щеше от светлината на лампата и Монката спря очи на нея, като че я виждаше за пръви път.
zhetvariat_07_yovkov_0016|Чакай! И друго каза Вълчан. Рече монката и се засмя. Добре ви е, син Кай, но си обеца на охото си я. Аз, Кай, ще му закача още една, да ме помни.
zhetvariat_07_yovkov_0017|Роздам поклад и глевай се усмихна.
zhetvariat_07_yovkov_0018|Ах, той е вълчан, той е вълчан! Провикна се тачката. Аз му знам, не му цера, ама айде. Да зе, ма аз... Не, не, аз нищо не знам, нищо не казвам, сакън! И като смигна на монката, той закри устата си, щепа и зави като вълк.
zhetvariat_07_yovkov_0019|Монката се засмя, обърна се и потърси с очи дяда Нетка. Иконописъцът беше полегнал на одара, тък му под картината си изпеше. «Аз да си ходя», каза Монката и стана. Гроздан се опита да го спре. «Стой, Монка, защо бързаш?» «А, късно е, ще си ходя». «Иди си, Монка, иди си! Вълци има!» Закиска се тачката и пак зави като вълк.
zhetvariat_07_yovkov_0020|Яна разлавай кучетата, каза момката и излезе.
zhetvariat_07_yovkov_0021|Гроздан и тачката останаха сами. Дядо Нетко спеше. Тачката се опита да заговори нещо, но Гроздан не го слушаше. Тогава той подпря глава на ръката си, загледа се през прозореца и зата наника дрезгаво, грозно.
zhetvariat_07_yovkov_0022|Гроздан пушеше и напрегнато мислеше нещо.
zhetvariat_07_yovkov_0023|Преди няколко време той беше ходил в града и адвокатът беше му казал, че ако не се съберат доказателства и не се намерят сигурни свидетели, делото е изгубено. Ето защо Вълчан ставаше дързък.
zhetvariat_07_yovkov_0024|Да ми вземе нивите ли? – мислиша си гроздан. – Аз ръцете му ще струша.
zhetvariat_07_yovkov_0025|Той пушеше, мислеше, лицето му като че се вкаменяваше, а очите му горяха.
zhetvariat_07_yovkov_0026|Изведнъж Гроздан стана и се огледа. Дядо Нетко хъркаше, тачката беше отпуснал глава на масата и също спеше. Тихо, напрасти, като се пазеше да не направи най-малкия шум Гроздан излезе, затвори вратата след себе си, после всета и тихо отиде и надникне в кръчмата. Там нямаше никой. Къньор едеше кюмюр под гюма. Гроздан знаеше ряда на работата му всяка вечер, след малко той щеше да приброи парите си, да запише нещо в тефтери,
zhetvariat_07_yovkov_0027|Бързо и колкото се може по-тихо, Груздан излезе през задната врата в двора на Къньо, а от там на улицата.
zhetvariat_07_yovkov_0028|Той не се забави твърде много и се върна по същия път.
zhetvariat_07_yovkov_0029|Но когато притваряше вратата на стаячката, тачката подигна глава, погледна го с мътни сънливи очи и каза, «А, къде си ходил?» «Никъде не съм ходил», рече Груздан.
zhetvariat_07_yovkov_0030|Но тачката не го и чуи и пак сложи глава на масата.
zhetvariat_07_yovkov_0031|Гроздан дойде до прозореца и погледна навън.
zhetvariat_07_yovkov_0032|Отначало нищо не се виждаше. След туй отляво и от дясно се бял на снегът, а по средата се чернееха върбите край реката и увошките в градините. Нищо друго не се виждаше. Селото спеше.
zhetvariat_07_yovkov_0033|Мина се някое време. Изведнъж над черните клони на дърветата, преплетени като мрежа, блесна нещо като светкавица. След туй, още два-три такива блясъци и веднага след тях се разгоря широко сияние. Заизхвърчаха искри. Лизнаха нагоре в тъмнината пламъци.
zhetvariat_07_yovkov_0034|Гроздан се отдръпна от прозорица и започна да си прави цигара. Ръцете му трепереха.
zhetvariat_07_yovkov_0035|Изведнъж пукна пушка, след нея друга. Стъклото на прозореца доскоро тъмно, сега пламна, огнено-червено.
zhetvariat_07_yovkov_0036|Гръмежите зачастиха тревожно и бързо забит сърковната камбана.
zhetvariat_07_yovkov_0037|— Какво има? — попита тачката. Вънзичо гласът на Къня. — Къде е? Какво гори?
zhetvariat_07_yovkov_0038|Някой му отговори, но не може да се чуе.
zhetvariat_07_yovkov_0039|Изведнъж встае да се вторна къньо и я извика. Пожар! Съплъците на вълчана горят!
zhetvariat_07_yovkov_0040|Съплъците на вълчана ли? Каза тачката и едва м сега забеляза огненото зарево в прозорица. Бре, че то голям огън бе! Съплъците на вълчана, а? Ох, мамо!
zhetvariat_07_yovkov_0041|Къньо беше излязъл. Тачката срещна погледа на Груздана, оторачи се в него, след то и се позасмяло каво започна да се чеше под малкото си кълпаче и каза, «Хм, ти затои ли излиза?» «Кога съм излизал? Не съм излизал аз!» Сопното му отварна Груздан. «Еде, не бой се, от мене дума не излиза!» Засмя се тачката и като се загледа в пламналия прозорец добави, «Ох, мамо, гори, гори!»
zhetvariat_07_yovkov_0042|Вънзичо гласът на нея е кокмета. Защо никой не излиза от та смахала? Искат да изгоре цялото село ли? Кои са тука?
zhetvariat_07_yovkov_0043|Навярно кънь му пришепна нещо, защото и ней коснеше гласа си. Но Гроздан беше до вратата и чу как нейко каза. Гроздан ли? Той все тук ли беше? Не е ли излизал?
zhetvariat_07_yovkov_0044|Не е излизал, а закъню.
zhetvariat_07_yovkov_0045|Когато гроздани тачката тръгнаха да се отиват вън беше видело като денем. Над черните клони на овошките се люлеяха, като то се огъваха, то се издигаха нагоре големи пламъци. Широко сияние трептеше и разделяше нощта на две. Отвъд пожара беше тъмна, черна стена, а от сам беше светло. По снега лъщяха червени блясъци, върчаха искри и черни вълма дим се носеха на юг, гонени от вятъра като подплашено стадо.
zhetvariat_07_yovkov_0046|Чуваше се страшна глъчка. Кучетата на цяло се елолаеха.
zhetvariat_07_yovkov_0047|Край на глава 7. Този запис е обществено достояние.
zhetvariat_08_yovkov_0000|Житварят глава 8. Записано за LibriVox.org
zhetvariat_08_yovkov_0001|Житварят повестватюрда Ниовков глава 8
zhetvariat_08_yovkov_0002|Дойде най-после пролетта. Дойде някак изведнъж и нечакано. Последни веялици, както всякога имаше, но те стихват скоро. Изгрява слънце. Небето се усмихва ясно и синьо като никога. Ослепително блещи снегът. Лъчи и светлина се къпи всичко. Стопля се. От стрехите започва да пада сняг. Къпчуците закапват. Вратци се трупат на припек по плетищата и дигат весела врява. От час на час става по-топло.
zhetvariat_08_yovkov_0003|Чувства се присъствието на нещо ново, бодро и животворно.
zhetvariat_08_yovkov_0004|Синият дим на кумините се стеля надолу и бяга на север. Овошките поклащат мокрите си клони. Тихо и замислено прошумяват, потръпнали сякаш в сладки сънища.
zhetvariat_08_yovkov_0005|Подухва вятър. Той е мек и приятен като милувка. Иде откъм юг. Топа ли?
zhetvariat_08_yovkov_0006|Това е Лодосът, могълщият пред течена пролетта.
zhetvariat_08_yovkov_0007|Слънцето засяда, кърваво пятно в оловината маса на облаците. Ни дъжд, ни сняг ще вали. Тия облаци са високи, тънки и тук там през тях успява да наникне някоя звезда. На запад месецът извива тънкия си сърб. Топло е, както през деня.
zhetvariat_08_yovkov_0008|Лодосът не подухва, без не е вече. Почив клоните на увожките, свирев разтрозите на прозорците, бочив комините, руква вода от стрехите и капчуците, сякаш барабани отмерено и гръмко бият тръжествен някой марш.
zhetvariat_08_yovkov_0009|Нещо иде, приближава се, върви по всички посоки и по всички пътища.
zhetvariat_08_yovkov_0010|Иде пролетта. Иде с безбройното си пъстро воинство, весело, шумно, жизнерадостно.
zhetvariat_08_yovkov_0011|Иде всичко това, което ще насели горил, сои и полета.
zhetvariat_08_yovkov_0012|Въседна ли едри шарени коне в златолуспести брони? Не пристъпват ли огнени змейове по ели път към тъмни пещери? Зелено оки юди не препускат ли насурелени? Несе ли развяват разбърканите им гуси и бичовите им, изплетени от зми и не съскат ли из вятъра?
zhetvariat_08_yovkov_0013|Млечно бяла мъгла се носи над полето, едва могряна от сърпъна месеца. Заловени в несключено хоро, не са ли леки самодиви? Не техните ли песни отекват и звучат в романа на хилядите потоци?
zhetvariat_08_yovkov_0014|Лодусът се усилва все повече.
zhetvariat_08_yovkov_0015|Това е вече буря, което без не е луми, събаря.
zhetvariat_08_yovkov_0016|Стая буря и не пролета.
zhetvariat_08_yovkov_0017|Тя идёт към Юг.
zhetvariat_08_yovkov_0018|На тая страна небето е ясно и свети като широко разкрити двери.
zhetvariat_08_yovkov_0019|Чудото се извършва всякъж в една само нощ.
zhetvariat_08_yovkov_0020|Редят се понататък ясни дни, спокойни и тихи. Снега го няма вече. Туктаме се белее нещо, но изведнъж не може да се познае дали е някой закъсняла пряспа или пък кукичета се нацъвте ли.
zhetvariat_08_yovkov_0021|Земята е суха, лодосът не прекратява огнедежищите си пориви. Млади кълнове пробождат рогкавата пръст, овощките изпъват с наслада клоните си в топлия въздух, пъпките им набъбват и се разпукват.
zhetvariat_08_yovkov_0022|Около първите цветове на сливите брамчат пчели.
zhetvariat_08_yovkov_0023|Една сутрин през тия дни Нейко кметът не можа да се здържи в къща и излезе да пообиколи из полето. Почнали се бяха пролетните си идби. Ободрен от хубавото време, Нейко върви бързо, поглежда насам, поглежда нататък. Рано е. Слънцето току-що беше изгряло, а колята на сиячите накацали по нивите като птици. Тук върволи цъволове. Погребена на някой, баирите се виждат пригрбени като кости нурки. Бавно и тежко влачат плуг.
zhetvariat_08_yovkov_0024|Всичко се вижда като на длан. Широко поле, равно поле. Да викнеш, кой знае докъде ще те чуят.
zhetvariat_08_yovkov_0025|И още тихо, а не...
zhetvariat_08_yovkov_0026|Нейко се спира, снема кълпака си за да си избърши потта и гледа нагоре. Где са тия чучолиги? Колко са?
zhetvariat_08_yovkov_0027|Нищо не се вижда, цялото небе кантира си дъжд от песни. Нейко тръгва пак, но едва м направил няколко крачки и отново се спира. Хо-хо, викат някъде далеч. Хо-хо, отзовават се други.
zhetvariat_08_yovkov_0028|Ето припускат нататък и конници. Дигна ли се някой вълк, мисля се някой се усмихва.
zhetvariat_08_yovkov_0029|Най-напред нейко заобиколития свои ниви, които бяха засети вече. Той преглежда внимателно всичко. Занича там, занича тук. Работата беше свършена хубаво. Няма какво да се каже, но все пак имаше нещо, което е можело и по-хубаво да се направи.
zhetvariat_08_yovkov_0030|И за ей две частия грижи, малко е досън, неко тръгва право към нивата, гдето син му Марин и слугата сейха.
zhetvariat_08_yovkov_0031|Той стигна там, спря се и без да каже нещо застана на страна.
zhetvariat_08_yovkov_0032|Син му упълнеше десагите с семя от колата и като видя баща си, позасмя се, че и той е дошел на нива. След той, с напълнени десаги на рамо, той влезе в браздите и започна да сее. «Не тъй, Марине, не тъй!» завика изведнъж нейко. «Размахвай раката, повече я размахвай!»
zhetvariat_08_yovkov_0035|Нейко се натъкме и започна. Загледан на няколко крачки пред себе си, той крачеше широко, но отмерено и спокойно. Под всяка стъпка на левия си крак, с винаги едно и също размахване на дясната си ръка той хвърляше семето. Зърната блясваха във въздуха като златна струя, след тото и падаха и се губяха между буците на пръста. И всичкото й се повтаряше всета и правилно, със същото будно внимание, със същата съсредоточеност.
zhetvariat_08_yovkov_0036|Няколко пъти неяко изпразвай напълва десагите и винаги, когато дойдеше до кулата казваше на Марина.
zhetvariat_08_yovkov_0037|Стъпиш ли с левия крак, върлей. Ама тъй равно, навред еднакво да се пръска. Че ако не го хвърлеш както трябва, как ще изникне, ще се смеят хората.
zhetvariat_08_yovkov_0038|Най-после Нейко се умори, снеди сагите и ги даде на Марина. Той доста беше се поизпутил, но изглеждаше доволен и радостно възбуден. И като посочи собствената си работа за пример, като даде още много съвети и напътвания, Нейко хвърли последен поглед към нивата и си тръгна за село. Сега той не поглеждаше нито на една, нито на друга страна.
zhetvariat_08_yovkov_0039|По-добро време за сейдба, мислеше си той, не може да бъде. Ако и таз година стане хубав беракет, ще съборя дама и ще направя нов. И нов хамбар може да направя.
zhetvariat_08_yovkov_0040|и не я куминаваше от план на план, пресмяташе, вглебяваше се в себе си.
zhetvariat_08_yovkov_0041|В общината, освен кихаята, той не намели никого. Както се виждаше и писарите за етиите, повече с земеделските си работи бяха позакъснели.
zhetvariat_08_yovkov_0042|Просетели също липсваха. За книжа и справки никой не се явяваше.
zhetvariat_08_yovkov_0043|А за Данаци, помисли си нейко, Боже упази, кой ще ти плаща Данаци сега?
zhetvariat_08_yovkov_0044|Нейко се позавъртя колкото да си почине, сложе туктаме няколко подписа и излезе. Село беше тихо, ора не се виждаха.
zhetvariat_08_yovkov_0045|Нейко не намираше защо да се развлече и нищо не му оставаше, освен да гледа и да се радва на хубавото време.
zhetvariat_08_yovkov_0046|Той наближи до работилницата на Йордан Ковача. Дим излизаше не само из куминя, но и през широките отвори отпред, където зимно време Ковачът слагаше стъкла.
zhetvariat_08_yovkov_0047|Силни, припрени удари на чук се чуваха, а под тях мелодично пееше върсът.
zhetvariat_08_yovkov_0048|Ковачът беше претрупан с работа. Кола, плугове, жетварки и какви неоща сечева бяха натрупани пред ковачницата му и чакаха ред, като болни при лекар.
zhetvariat_08_yovkov_0049|Нейко се отби да погледа, спря се и се изправи на вратата, но не свари да поздрави, защото тъкмо в тая минута ковачът изтегли с щипците едно зачервено желязо, тури го наверса и викна на слугата си.
zhetvariat_08_yovkov_0050|Момчето това и чакаше, дигна чука и започна да слага удар след удар върху желязото, а Йордан го въртеше с щипците и подлагаше то една, то друга страна.
zhetvariat_08_yovkov_0051|Към края сам той започна да удресчука си и с удивителна бързина придаваше на желязото оная форма, която искаше.
