zhetvariat_16_yovkov_0098|Че и ни не сме ли християни, бе? Зашепна той стия актьорски движение и мимика, на които беше способен. Да запалим най-сетни и ни по една свещ като хората. Видиш ли я каква е Великданска? Господу, Господу, помолим ся!
zhetvariat_16_yovkov_0099|Гроздан го гледаше и стръпнал измаян.
zhetvariat_16_yovkov_0100|Чакай да видим сега. Продължаваше тачката като поднасяше свища към иконата. Какво ме гледаш такъв? Никой няма да ни види, не бой се. И вън свети, и тук свети. Ааа, че ти си го откъртил вече? Държи се съвсем малко.
zhetvariat_16_yovkov_0101|Разкривени смачкан венецът се крепеше само на един и си край. Предишното му място се очертаваше от многобройни кръстосени дръскотини, оставени от ножа. Тачката приближа още повече свищта.
zhetvariat_16_yovkov_0102|Пламъкът затрептя. Заиграха сенки и блясъци по гланцираната повърхност на иконата. Чертите на лицето сякаш се оживиха. Очите загоря огън и те устремиха своя благ и кротък поглед.
zhetvariat_16_yovkov_0103|Гроздан гледаше, развълнуван и смутен. Изведнъж очите му се втренчеха на едно място и се разшириха от ужас.
zhetvariat_16_yovkov_0104|Нещо червено и мокро светеше върху самото чело на иконата.
zhetvariat_16_yovkov_0105|Гроздан изпъшка и не слезе, а просто се струполи от стола. Бледен, си скривено от оплаха лицето и гледаше към иконата. — Какво стана, какво има? — очудено изсмутено питаше тачката и гледаше то него, то иконата. — Кръв. Кръв има там. Не виждаш ли? На челото.
zhetvariat_16_yovkov_0106|Тачката премести свеща и внимателно се вгледа в посоченото място. На самото чело на Исуса, там, гдето косите се разделяха на път, блещеше няколко капки мокра кръв.
zhetvariat_16_yovkov_0107|Тачката изкриви глава и се зачуди. Той се обърна, изгледа гроздана от глава до пети, погледна иконата и после пак гроздана. Той търсеше, съобразяваше нещо. Изненадата и страхът на лицето му малко по малко се изгубваха и се заменяха с насмешлива и весела гримаса.
zhetvariat_16_yovkov_0108|– Ех, че си смешен, Гроздане, каза той. Разбира се, че ще има кръв. Че ти си се одраскал и не си усетил. На, виж ръката си! Гроздан се погледна. Длънта на дясната му ръка беше зачервена от кръв. Виждаше се и малка раничка.
zhetvariat_16_yovkov_0109|Наистина, каза той, порязал съм се, пък аз рекох, гледай ама работа, а?
zhetvariat_16_yovkov_0110|Той се успокои и погледна тачката и след това и двамата се разсмяха.
zhetvariat_16_yovkov_0111|Венецът се крепеше слабо. Тачката го дръпне и го откъса. После той слезе, почна да го оглежда, обръщаше го и го подхвърляше на ръката си, като че искаше да определи горе долу дежаста му. Златният лист ярко блещеше в нечистите му ръце.
zhetvariat_16_yovkov_0112|Той продължаваше да го гледа щастлива и самодоволна усмивка за игра на лицето му.
zhetvariat_16_yovkov_0113|Най-после, както всеки вещ познавач, извади ножа си, направи няколко дръскотини по венеца и отблизо ги разгледа на свеща. Няколко пъти подред той повтори това.
zhetvariat_16_yovkov_0114|Изведнъж раздразнение и ад сбърчеха цялото му лице.
zhetvariat_16_yovkov_0115|Дявол да го земе! – извика той. – Той не било злато! – Никакво злато не е! – Не е! Не е! Сребро е и отгоре само малко позлатено. Ах, тоз дърд чарлатанин, тоз лъжец! Виждаш ли го? И тука си показал! Не е, не е злато! Тюх!
zhetvariat_16_yovkov_0116|Той цъкаше си зик, тюхаше си, но гроздан не го чуваше.
zhetvariat_16_yovkov_0117|През всичкото време, докато тачката беше стоял със свеща под иконата, Гроздан беше гледал само нея.
zhetvariat_16_yovkov_0118|Виждаше я за първи път.
zhetvariat_16_yovkov_0119|Виждаше озрелите жълти ниви, приведените пълни гласове. И сред тях върви Исус.
zhetvariat_16_yovkov_0120|Господи, как гледаха тия скръбни и благи очи!
zhetvariat_16_yovkov_0121|Начелото му светеха алените капки кръв, обграждаха го дръскотините от ножа.
zhetvariat_16_yovkov_0122|Но всичко това не променеше с нищо лицето му, не отгонваше и не намаляваше тая съсредоточена мисъл, тая голяма любов, с която той гледаше готовите зажетвани ви и ги благославеше.
zhetvariat_16_yovkov_0123|Гроздан гледаше изумен и вцепенен.
zhetvariat_16_yovkov_0124|Къде беше виждал той всичко това?
zhetvariat_16_yovkov_0125|Беше го виждал, но кога? Как?
zhetvariat_16_yovkov_0126|Умиление изпълни душата му. Как можа да дигне ръка против него? Защо е дошъл тука?
zhetvariat_16_yovkov_0127|Обзегло отчаяние, голяма и страшна рана сякаш се откри в душата му и е обляз непоносима болка.
zhetvariat_16_yovkov_0128|Грях е това. Страшен грях. Викаше и стенеше нещо в него. Той не можеше да откъса очите си от иконата и от минута на минута вълнението му се усилваше.
zhetvariat_16_yovkov_0129|Тачката продължаваше да оглежда Венеца и да се вайка. Обхванът от неодържима омраза Гроздан се спусна към него и огаси свеща в ръцете му. – Да си вървим! – викна му той грабна и мурлука си. – Да си вървим! По-скоро! – Чакай! Що огаси свеща? – Не видя ли, че не е? – Върви, ти казвам! – Извика пак Гроздан.
zhetvariat_16_yovkov_0130|Той беше силен и просто го повлече със себе си. Тачката долови в гласа му тая властна и непреклонна воля, която той добре познаваше, не разбираше добре отгде идеше, нечаканият му гнявно се подчини. Излязоха навън. Посрещни ги хладен и пресен въздух. Валеше още, но вече без вятър, равно и тихо. Светкавиците припламваха порядко и грамотевиците глъхнаха надалече. Бурята беше преминала.
zhetvariat_16_yovkov_0131|Гроздан и тачката прекосиха черковния двор и излязоха на улицата. Винаги предпъзлив и съобразителен, тачката се спираше често, услушваше се и се оглеждаше на всички страни. Той се забави, остана назад. Гроздан крачеше пред него широко и бързо и не обръщаше внимание на нищо. Той кривна на едно място и пое пътя за у дома си. Тачката свирна по дире му. Гроздан се спря и го зачака.
zhetvariat_16_yovkov_0132|Е, той нещо не си чини труда! Зашепна тачката като се приближи и показа венеца под ямурлука си. Какво ще го правим? Прави го каквото щеш! Сопна му се гроздан. Мене нищо не ми трябва.
zhetvariat_16_yovkov_0133|и без да прибави дума повече, той се обърне и продължи пътя си.
zhetvariat_16_yovkov_0134|Тачката погледна подирямо очудено, поклати глава и като се озърна още веднъж на сам нататък, бързо засетни слеките си и без шумни стъпки.
zhetvariat_16_yovkov_0135|Светкавиците хвърляха кратки синкави блясъци, листата на дърветата шумолеше да ждат.
zhetvariat_16_yovkov_0136|Някъде из селото пропяпя тел.
zhetvariat_16_yovkov_0137|Крайна глава, 16-а.
zhetvariat_16_yovkov_0138|Този запис е обществено достояни.
zhetvariat_17_yovkov_0000|ЖЕТВАРЕТ ГЛАВА 17
zhetvariat_17_yovkov_0001|записано за LibriVox.org
zhetvariat_17_yovkov_0002|Житварят. Повест от Юрдан Йовков. Глава 17.
zhetvariat_17_yovkov_0003|Кроздан се върна в къщи. Свали мокрия си е морлук и без да се съблича, тръшна се е легна на одара. Той беше сам. Пет разпеше отвъд при болното. Вместо да се успокои, страхът и безпокойството му още повече пораснаха. Главата му гореше. Косите лепняха по челото му и той не можеше да разбере дъждът ли беше го измокрил или пък горещ пот го обливаше. Не беше ли го видял някой? Нямаше ли още утре да ги видя?
zhetvariat_17_yovkov_0004|Подобно малодушие, той никога не беше изпитвал и това го ядосваше. Внимателно и подред, като се мъчеше да бъде спокоен, той си припомни всичко. Работата беше извършена добре и предпазливо. Освен това, нощта беше тей тъмна и вятърат тей силен, че никой не можеше ни да забележи, ни да чуе нещо. Следи отстъпките им не можаха да останат, защото дъждът още валеше и щеше да ги залечи. Тачката пък не е вчерашен, за да позволи да направи
zhetvariat_17_yovkov_0005|И Гроздан повярвал, че всичко това е достатъчно да се успокои, метна постелката над себе си, затвори очи и се приготви да заспи.
zhetvariat_17_yovkov_0006|но сънят бягаше от него. Умът му гореше и мислите му постоянно се връщаха към едно и също нещо, подобно на нощните боболечки, които налитат върху пламъка на лампата.
zhetvariat_17_yovkov_0007|Едно видение не се махваше от въображението му и както и да се мъчеше не можеше да го отпъди. И сега, щом затвори очи, с поразителна яснота то отново се възправи пред него. Той виждаше пак иконата. Виждаше я тъй, както беше я гледал, когато тачката държеше свеща под нея.
zhetvariat_17_yovkov_0008|Жалтееха се озрелите ни, виесякаш нямаха край.
zhetvariat_17_yovkov_0009|Сред тях върви Исус. Умиление и някаква светла радост обливат душата на Гроздана. Той добре знае, че и друг път е изпитвал нещо подобно. Струва му се, че и друг път е виждали самия образ на Исуса, точно тъй както беше изписан на иконата.
zhetvariat_17_yovkov_0010|но венецът беше откъснат от собствената му ръка и неговият нож беше издълбал тия безбройни дръскотини.
zhetvariat_17_yovkov_0011|Кръвта стои още.
zhetvariat_17_yovkov_0012|Гроздан е готов да извика от болка, души го някакъв смътен и непонятен страх.
zhetvariat_17_yovkov_0013|И кой знае защо, както по-рано, те и сега наред свидението на иконата той виждаше и образа на баща си?
zhetvariat_17_yovkov_0014|Старецът е грохнъл и убит, като след някоя тежка работа. Лицето му е посърнало, очите скрити под побелелите вежди.
zhetvariat_17_yovkov_0015|Отчаяни сломен, той скръбно поклаща глава.
zhetvariat_17_yovkov_0016|Грях извършите, синко, говори той, голям грях.
zhetvariat_17_yovkov_0017|Гроздан охкаше, мяташе се ту на една, ту на друга страна. Видял много опасности през живота си, извършил не едно престъпление вече. Задушил от коле гласа на съвестта си. Той е необоздан и безстрашен човек, изпитваше сега паническия страх на силен звяр, попаднал в примка. Мрежата на която му се вижда тънка и слаба, но която го омаломощава и задушава. Не навикнал да мисли и да си дава ясна сметка за преживяванията си.
zhetvariat_17_yovkov_0018|но странното видение на Исуса не се махваше от очите му.
zhetvariat_17_yovkov_0019|И мъчно му беше до сълзи, и онемялата му съвест викаше и се бунтуваше сега против един грях, непоправим и страшен.
zhetvariat_17_yovkov_0020|Образът на баща му стоеше неотлично пред него, като неомолим се дия, от когато нищо не можеше и не трябваше да крие.
zhetvariat_17_yovkov_0021|"Грях извърши ти, синко,"" говореше той."
zhetvariat_17_yovkov_0022|Гулян грях.
zhetvariat_17_yovkov_0023|Но къде и в какво най-после беше той него в грях?
zhetvariat_17_yovkov_0024|Това, че беше откраднал Венеца ли? Крадеше той не за първи път? Или защото тази кражба беше извършена в черква?
zhetvariat_17_yovkov_0025|Но и това малко го смуставаше.
zhetvariat_17_yovkov_0026|Невярващ той не беше, но пък и сам не знаеше добре как и в какво да вярва. Познаваше много хора, които и постеха, и ходеха редовно в черква, минаваха за набожни и за големи праведници, а най-тежки грехове се вършеха пак от тях.
zhetvariat_17_yovkov_0027|Злината и отровнато жило на такива свеци той сам беше изпитал. Да поступва като тях той не искаше, защото това не беше вяра, а лицемерие и лъжа.
zhetvariat_17_yovkov_0028|Радулов не се боеше да осъжда и да холи най-безмилостно подобни християни.
zhetvariat_17_yovkov_0029|Право и хубаво говореше той, макар, че понякога беше някак страшно да се слуша. Гроздан беше готов да се съгласи с него за всичко. Но учителят отиваше много далече в последната крачка, която той нехайно и без всякакъв страх правеше, там вече не всеки можеше да го придружи. Дълбоко в душата си Гроздан чувстваше, че да се отрича всичко не трябва, че Бог има и че без вяра не може. Това не беше съвсем ясно за него и неговият ум, нито можеше, нито се опитваше.
zhetvariat_17_yovkov_0030|Неговите мисли за тия отвлечени неща добиваха малко по-определена форма, когато си мислеше за баща си. А спомените му за него бяха те и живи сега.
zhetvariat_17_yovkov_0031|Старецът беше искрен и честен в душата, ясно и просто гледаше на всичко. За него вярата не беше нещо предобито и научено, не беше само обред и книжни предписания. Не беше тя и в честото ходене на черква, ни в постите, ни в курбаните и в задушниците. Тия работи той не смяташе излишни, но ги предоставяше на жените и на попа. Вярата за него беше неделима спътница на работата му. Изправяше ли се пред сейдбите,
zhetvariat_17_yovkov_0032|Това беше и благодарността, и молитвата му. Тъй благоговейно и смирено той не би стоял в черква и на най-големия празник.
zhetvariat_17_yovkov_0033|Две-три думи казваше само той, но те бяха сърдечни и топли, искрени и правдиви, защото идеха направо от сърцето.
zhetvariat_17_yovkov_0034|Случваше ли се пък суша, мор ли ходеше под обитъка, градушка ли убиваше нивята или пък друга някоя тежка напаст се надвисваше над хората, дядо Добре не роптаеше. Ще търпим, Божа воля е, казваше той, утешаваше се лесно и сред най-големите злочастини оставаше си твърд и непоколебим.
zhetvariat_17_yovkov_0035|Тръгнаше ли на път, преди да се качи на колата и да поеме юздите на конете, той се прекръстваше набързо, но набожно. Можеше да бъде най-лошо време. Виелици и преспи можеха да затрупват пътищата, можеха да го заплашват какви неопасности. Той не тръпваше и не се боеше от нищо. Той беше спокоен и безгрижен, защото беше вече предоставил участа си в ръцете на Бога.
zhetvariat_17_yovkov_0036|Гроздан познаваше добре силата на тая вяра. Някога и той сам постъпваше също тей, както беше запомнил и видял от баща си. И вършеше това не по подражание, не за обичай, а тласкан от една вътрешна нужда. Не веднъж и той, изправен пред слога на озрялата и готова за жетва Нива, преди да размаха косата си из нея, той се спираше, сваляше шапката си и се прекръстваше. Един-два мига оставаше тъй неподвижен и залисан.
zhetvariat_17_yovkov_0037|Но всичко това само на неговият рът ли се дължеше?
zhetvariat_17_yovkov_0038|не зная ни, не сигурен е всякога краят на земледалската работа.
zhetvariat_17_yovkov_0039|Заровили веднъж семето в земята, не човекът е вече господарят.
zhetvariat_17_yovkov_0040|Може студове и мраз да изсушат крехите кълнове, може дъждове и киша да удавят избоялите ниви, може вятър да ги опали и суша да ги изгори. Или пък, запазени от всичко, озрели и готови за сърпа, и ето, черен облак се задава, святка се, гърми. Дъжд ли ще е или градушка? Боже! Викаш тогава, върни го, отведи го настрана.
zhetvariat_17_yovkov_0041|Нестопанината Бог отглежда, Той е плод, Той го пази, Той го дава.
zhetvariat_17_yovkov_0042|Как гъста и висока е нивата, как тежети се превиват пълните класове. Гледаш, радваш се, сълзи идат на очите ти. Може ли да не помислиш за Бога? Може ли да не се прекръстиш? Неговото присъствие се усеща, Той е тук, Той пристъпва между нивите. Същият, същият Той образ, благ, кротък, благославещ. Той е. Той.
zhetvariat_17_yovkov_0043|Гроздан скочи и приседна на леглото. Мислите му бяха добили извънредно голяма яснота.
zhetvariat_17_yovkov_0044|Сега вече той разбираше и си обясняваше всичко. Често се случва да чувстваме нещо, без да можем да го определим или изкажем. И една дума само, едно далечно подсещане изведнъж прави ясно това, което е било подсъзнателно изкрито. Нещо подобно беше станало с Груздана.
zhetvariat_17_yovkov_0045|Едвам сега той разбра защо образът, който беше видял на иконата, не изглеждаше нов за него. До тогаз той не би могъл да каже, че го е виждал, но той беше го чувствал, беше го носил в себе си. Неловимо, неясно. Определен и завършен той образ той виждаше сега в иконата. Той не беше му чувств. Той се раждаше в душата му и спомените му и сам Гроздан не можеше вече да прави разлика между сегашното и веденството.
